### ISSUE TITLE
shows 'No Data Available' for valid ZMQ nprobe

### ISSUE THREAD

**Issue by WarrenOpus** [ntop/ntopng#327]
Ubuntu Server 14.04.3 LTS x64
ntopng Professional v.2.2.151204
nProbe v.7.2.1
ufw status - disabled
Core i5
12Gb Ram
Gigabit Network card

I start 8 collectors.... 
nprobe --zmq tcp://_:5555 -i none -n none --collector-port 2055
nprobe --zmq tcp://_:5556 -i none -n none --collector-port 2056
nprobe --zmq tcp://_:5557 -i none -n none --collector-port 2057
nprobe --zmq tcp://_:5558 -i none -n none --collector-port 2058
nprobe --zmq tcp://_:5560 -i none -n none --collector-port 2060
nprobe --zmq tcp://_:5561 -i none -n none --collector-port 2061
nprobe --zmq tcp://_:5563 -i none -n none --collector-port 2063
nprobe --zmq tcp://_:5564 -i none -n none --collector-port 2064

the Cisco Firewalls sending these Netflow streams are on relatively busy but small networks (only a handful of hosts but they are always active). So there is definitely a constant stream of Netflow packets arriving. NB\* UFW is disabled (as we are aware that tcpdump operates before iptables)
# tcpdump port 2055

16:41:05.115383 IP 192.168.13.254.18656 > Netflow.2055: UDP, length 1428
16:41:05.483752 IP 192.168.13.254.18656 > Netflow.2055: UDP, length 1380
# tcpdump port 2056

16:33:43.735168 IP 192.168.50.254.16608 > Netflow.2056: UDP, length 1448
16:33:44.825864 IP 192.168.50.254.16608 > Netflow.2056: UDP, length 1420
# tcpdump port 2057

16:33:47.913730 IP 192.168.0.1.16724 > Netflow.2057: UDP, length 1368
16:33:48.137858 IP 192.168.0.1.16724 > Netflow.2057: UDP, length 1408
# tcpdump port 2058

16:33:54.732441 IP 192.168.18.254.33999 > Netflow.2058: UDP, length 596
16:33:59.950544 IP 192.168.18.254.33999 > Netflow.2058: UDP, length 228
# tcpdump port 2060

16:45:23.274062 IP 192.168.41.254.52922 > Netflow.2060: UDP, length 1460
16:45:24.119067 IP 192.168.41.254.52922 > Netflow.2060: UDP, length 1460
# tcpdump port 2061

16:34:31.028447 IP 192.168.1.2.57365 > Netflow.2061: UDP, length 1468
16:34:31.483408 IP 192.168.1.2.57365 > Netflow.2061: UDP, length 1460
# tcpdump port 2063

16:34:50.828124 IP 192.168.15.254.1959 > Netflow.2063: UDP, length 1008
16:34:55.407548 IP 192.168.15.254.1959 > Netflow.2063: UDP, length 1468
# tcpdump port 2064

16:35:07.794186 IP 192.168.31.250.43411 > Netflow.2064: UDP, length 568
16:35:10.278492 IP 192.168.31.250.43411 > Netflow.2064: UDP, length 1436

A) When I login to ntopng sometimes I can only see flows for 1 or 2 networks (for many hours) other  Most of the time Interfaces show "No Data Available"
But when I logout and I tcpdump I can see there are many netflow packets arriving for _all_ networks. 
I know there are users on those networks as they are our remote offices in the same time zone. I log in to the Cisco Firewall and I can see network traffic graphs for these networks showing 2 -> 5Mbps of traffic, yet when I login to ntopng it says "No Data Available"

B) Totally inconsistent behavior of dashboard.lua - if start just 1 nprobe ZQM it will not show traffic for that interface.  But if I start all 8 nprobes ZQM I might see traffic for the least busy network and no flows for the busiest/largest network. It's as if ntopng gets confused? 

htop shows the memory usage of the server is at 15% and CPU is about 10%. 
## my ntopng.conf file contents:

-G=/var/tmp/ntopng.pid
-e=
-i=tcp://192.168.13.7:5555
-i=tcp://192.168.13.7:5556
-i=tcp://192.168.13.7:5557
-i=tcp://192.168.13.7:5558
-i=tcp://192.168.13.7:5560
-i=tcp://192.168.13.7:5561
-i=tcp://192.168.13.7:5563
-i=tcp://192.168.13.7:5564
-w=3000
-m=192.168.51.0/24,192.168.13.0/24,192.168.0.0/24,192.168.1.0/24,192.168.21.0/24,192.168.41.0/24,192.168.18.0/24,192.168.31.0/24,192.168.50.0/24,192.168.16.0/24,192.168.15.0/24
-n=1
-d=/var/tmp/ntopng
-q=

**Comment by WarrenOpus** [comment]
I tried some experiments. If I delete everything in /var/tmp/ntopng/ and restart ntopng 
The log shows me this

21/Dec/2015 17:42:59 [Ntop.cpp:933] Setting local networks to 192.168.51.0/24,192.168.13.0/24,192.168.0.0/24,192.168.1.0/24,192.168.21.0/24,192.168.41.0/24,192.168.18.0/24,192.168.31.0/24,192.168.50.0/24,192.168.16.0/24,192.168.15.0/24
21/Dec/2015 17:42:59 [Redis.cpp:106] Successfully connected to redis 127.0.0.1:6379@0
21/Dec/2015 17:42:59 [NtopPro.cpp:119] [LICENSE] Reading license from /etc/ntopng.license
21/Dec/2015 17:42:59 [Ntop.cpp:907] Parent process is exiting (this is normal)
21/Dec/2015 17:42:59 [Ntop.cpp:1152] Registered interface tcp://192.168.13.7:5556 [id: 2]
21/Dec/2015 17:42:59 [Ntop.cpp:1152] Registered interface tcp://192.168.13.7:5557 [id: 3]
21/Dec/2015 17:42:59 [Ntop.cpp:1152] Registered interface tcp://192.168.13.7:5558 [id: 4]
21/Dec/2015 17:43:00 [Ntop.cpp:1152] Registered interface tcp://192.168.13.7:5561 [id: 6]
21/Dec/2015 17:43:00 [Ntop.cpp:1152] Registered interface tcp://192.168.13.7:5564 [id: 8]
21/Dec/2015 17:43:00 [Ntop.cpp:1152] Registered interface tcp://192.168.13.7:5560 [id: 10]
21/Dec/2015 17:43:00 [Ntop.cpp:1152] Registered interface tcp://192.168.13.7:5563 [id: 11]
21/Dec/2015 17:43:00 [Ntop.cpp:1152] Registered interface tcp://192.168.13.7:5555 [id: 13]
21/Dec/2015 17:43:00 [Ntop.cpp:1165] Registered interface view tcp://192.168.13.7:5556 [id: 2]
21/Dec/2015 17:43:00 [Ntop.cpp:1165] Registered interface view tcp://192.168.13.7:5557 [id: 3]
21/Dec/2015 17:43:00 [Ntop.cpp:1165] Registered interface view tcp://192.168.13.7:5558 [id: 4]
21/Dec/2015 17:43:00 [Ntop.cpp:1165] Registered interface view tcp://192.168.13.7:5561 [id: 6]
21/Dec/2015 17:43:00 [Ntop.cpp:1165] Registered interface view tcp://192.168.13.7:5564 [id: 8]
21/Dec/2015 17:43:00 [Ntop.cpp:1165] Registered interface view tcp://192.168.13.7:5560 [id: 10]
21/Dec/2015 17:43:00 [Ntop.cpp:1165] Registered interface view tcp://192.168.13.7:5563 [id: 11]
21/Dec/2015 17:43:00 [Ntop.cpp:1165] Registered interface view tcp://192.168.13.7:5555 [id: 13]
21/Dec/2015 17:43:00 [Utils.cpp:304] User changed to nobody
21/Dec/2015 17:43:00 [main.cpp:240] PID stored in file /var/tmp/ntopng.pid
21/Dec/2015 17:43:00 [HTTPserver.cpp:458] Please read https://github.com/ntop/ntopng/blob/dev/doc/README.SSL if you want to enable SSL.
21/Dec/2015 17:43:00 [HTTPserver.cpp:501] Web server dirs [/usr/share/ntopng/httpdocs][/usr/share/ntopng/scripts]
21/Dec/2015 17:43:00 [HTTPserver.cpp:504] HTTP server listening on port 3000
21/Dec/2015 17:43:00 [main.cpp:290] Working directory: /var/tmp/ntopng
21/Dec/2015 17:43:00 [main.cpp:292] Scripts/HTML pages directory: /usr/share/ntopng
21/Dec/2015 17:43:00 [Ntop.cpp:260] Welcome to ntopng x86_64 v.2.2.151204 - (C) 1998-15 ntop.org
21/Dec/2015 17:43:00 [Ntop.cpp:265] Built on Ubuntu 14.04.2 LTS
21/Dec/2015 17:43:00 [PeriodicActivities.cpp:53] Started periodic activities loop...
21/Dec/2015 17:43:00 [RuntimePrefs.cpp:32] Dumping alerts into syslog
21/Dec/2015 17:43:00 [NtopPro.cpp:233] [LICENSE] ntopng systemId: 4A831FDA09B1B8A9
21/Dec/2015 17:43:00 [NtopPro.cpp:244] [LICENSE] ntopng license: 585AAA09FB543E63D9A30F5164E60FBB1481336906A9545AE9
21/Dec/2015 17:43:00 [NtopPro.cpp:265] [LICENSE] Maintenance is available until Sat Dec 10 09:28:26 2016 [354 days left]
21/Dec/2015 17:43:00 [NetworkInterface.cpp:1426] Started packet polling on interface tcp://192.168.13.7:5556 [id: 2]...
21/Dec/2015 17:43:00 [NetworkInterface.cpp:1426] Started packet polling on interface tcp://192.168.13.7:5557 [id: 3]...
21/Dec/2015 17:43:00 [NetworkInterface.cpp:1426] Started packet polling on interface tcp://192.168.13.7:5558 [id: 4]...
21/Dec/2015 17:43:00 [NetworkInterface.cpp:1426] Started packet polling on interface tcp://192.168.13.7:5561 [id: 6]...
21/Dec/2015 17:43:00 [NetworkInterface.cpp:1426] Started packet polling on interface tcp://192.168.13.7:5564 [id: 8]...
21/Dec/2015 17:43:00 [NetworkInterface.cpp:1426] Started packet polling on interface tcp://192.168.13.7:5560 [id: 10]...
21/Dec/2015 17:43:00 [NetworkInterface.cpp:1426] Started packet polling on interface tcp://192.168.13.7:5563 [id: 11]...
21/Dec/2015 17:43:00 [NetworkInterface.cpp:1426] Started packet polling on interface tcp://192.168.13.7:5555 [id: 13]...
21/Dec/2015 17:43:00 [CollectorInterface.cpp:94] Collecting flows on tcp://192.168.13.7:5555
21/Dec/2015 17:43:00 [CollectorInterface.cpp:94] Collecting flows on tcp://192.168.13.7:5557
21/Dec/2015 17:43:00 [CollectorInterface.cpp:94] Collecting flows on tcp://192.168.13.7:5558
21/Dec/2015 17:43:00 [CollectorInterface.cpp:94] Collecting flows on tcp://192.168.13.7:5561
21/Dec/2015 17:43:00 [CollectorInterface.cpp:94] Collecting flows on tcp://192.168.13.7:5563
21/Dec/2015 17:43:00 [CollectorInterface.cpp:94] Collecting flows on tcp://192.168.13.7:5556
21/Dec/2015 17:43:00 [CollectorInterface.cpp:94] Collecting flows on tcp://192.168.13.7:5560
21/Dec/2015 17:43:00 [CollectorInterface.cpp:94] Collecting flows on tcp://192.168.13.7:5564

Interfaces 
tcp://192.168.13.7:5556 [id: 2]
tcp://192.168.13.7:5558 [id: 4]
tcp://192.168.13.7:5560 [id: 10]
do not show any flows....
I check with tcpdump... there are netflow packets arriving!

So I check in the folder /var/tmp/ntopng/ 
and the corresponding folders for their IDs...2, 4, and 10

root@Netflow:/var/tmp/ntopng# tree -l 2
2
├── json
│   ├── 5mins
│   │   └── iface_2_lastdump
│   └── min
│       └── iface_2_lastdump
├── rrd
│   ├── bytes.rrd
│   ├── drops.rrd
│   ├── localstats
│   ├── num_flows.rrd
│   ├── num_hosts.rrd
│   ├── num_http_hosts.rrd
│   └── packets.rrd
└── top_talkers
    └── top_talkers.db

6 directories, 9 files
root@Netflow:/var/tmp/ntopng# tree -l 4
4
├── rrd
│   ├── bytes.rrd
│   ├── drops.rrd
│   ├── localstats
│   ├── num_flows.rrd
│   ├── num_hosts.rrd
│   ├── num_http_hosts.rrd
│   └── packets.rrd
└── top_talkers
    └── top_talkers.db

3 directories, 7 files
root@Netflow:/var/tmp/ntopng# tree -l 10
10
├── rrd
│   ├── bytes.rrd
│   ├── drops.rrd
│   ├── localstats
│   ├── num_flows.rrd
│   ├── num_hosts.rrd
│   ├── num_http_hosts.rrd
│   └── packets.rrd
└── top_talkers
    └── top_talkers.db

3 directories, 7 files

Not sure if that's of any use?

**Comment by lucaderi** [comment]
Can you please create and share individual pcaps (one per interface) with flows received on individual interfaces? Furthermore please share the ntopng config file.

**Comment by WarrenOpus** [comment]
When I try the dump-pkts switch....
nprobe --zmq tcp://*:5555 --dump-pkts 5555.pcap -i none -n none --collector-port 2055
nothing is put in any pcap files....

When I run this and define an interface,
nprobe --zmq tcp://*:5564 --dump-pkts /home/nidadmin/5564.pcap -i eth1 -n none --collector-port 2064 
it just dumps all netflows arriving on that interface (all netflows streams in one file)

I will continue investigating how to do this using the nProbe_UserGuide.pdf

**Comment by WarrenOpus** [comment]
ntop.conf file

-G=/var/tmp/ntopng.pid
-e=
-i=tcp://192.168.13.7:5555
-i=tcp://192.168.13.7:5556
-i=tcp://192.168.13.7:5557
-i=tcp://192.168.13.7:5558
-i=tcp://192.168.13.7:5560
-i=tcp://192.168.13.7:5561
-i=tcp://192.168.13.7:5563
-i=tcp://192.168.13.7:5564
-w=3000
-m=192.168.51.0/24,192.168.13.0/24,192.168.0.0/24,192.168.1.0/24,192.168.21.0/24,192.168.41.0/24,192.168.18.0/24,192.168.31.0/24,192.168.50.0/24,192.168.16.0/24,192.168.15.0/24
-n=1
-d=/var/tmp/ntopng
-q=

**Comment by WarrenOpus** [comment]
Instead I grabbed flows using tcpdump. I might have done this wrong, as only 1 file is recognized by wireshark as cflow. The rest show fragmented IP packets... 

I did it like this 
 tcpdump -s 0 port 2055 -i eth1 -w 55.pcap &
 tcpdump -s 0 port 2056 -i eth1 -w 56.pcap &
etc....
[pcap.zip](https://github.com/ntop/ntopng/files/69252/pcap.zip)

**Comment by lucaderi** [comment]
Please avoid using in nprobe "-i eth1 --collector-port 2064": better to use nprobe as probe or as collector but not both at the same time. You can use two instances.

**Comment by lucaderi** [comment]
I think you have some issues with your setup in particular if fragments are 100%. You have also not looked at the error messages properly. In fact if you start "nprobe --zmq tcp://:5564 -i none -n none --collector-port 2064" this is the error
22/Dec/2015 08:32:41 [util.c:4009] ERROR: Unable to bind ZMQ endpoint tcp://:5564: Operation not supported by device

as you must start instead 
nprobe --zmq "tcp://*:5564" -i none -n none --collector-port 

I believe this is the problem as I have tried and it works for me.

**Comment by WarrenOpus** [comment]
Confused... as I start using this command
nprobe --zmq tcp://*:5556 -i none -n none --collector-port 2056 
and it works just fine.... it never says it cannot start the operation....

root@Netflow:/home/nidadmin# nprobe --zmq tcp://_:5556 -i none -n none --collector-port 2056 &
[2] 6485
root@Netflow:/home/nidadmin# 22/Dec/2015 15:00:58 [nprobe.c:3130] Valid nProbe license found
22/Dec/2015 15:00:58 [nprobe.c:4488] WARNING: The output interfaceId is set to 0: did you forget to use -Q perhaps ?
22/Dec/2015 15:00:58 [nprobe.c:4491] WARNING: The input interfaceId is set to 0: did you forget to use -u perhaps ?
22/Dec/2015 15:00:58 [nprobe.c:4552] Welcome to nProbe v.7.2.151204 ($Revision: 4471 $) for x86_64-unknown-linux-gnu with native PF_RING acceleration
22/Dec/2015 15:00:58 [nprobe.c:4562] Running on Ubuntu 14.04.2 LTS
22/Dec/2015 15:00:58 [nprobe.c:4573] [LICENSE] nProbe SystemId: 4A831FDA09B1B8A9
22/Dec/2015 15:00:58 [nprobe.c:4584] [LICENSE] nProbe License:  D019F625A5EF737A281CCCFDD6CEA1BE1481341730C2268813
22/Dec/2015 15:00:58 [nprobe.c:4587] [LICENSE] nProbe Edition:  Standard [without PF_RING Acceleration]
22/Dec/2015 15:00:58 [nprobe.c:4614] [LICENSE] Maintenance is available until Sat Dec 10 10:48:50 2016 [353 days left]
22/Dec/2015 15:00:58 [nprobe.c:6526] Welcome to nprobe v.7.2.151204 for x86_64-unknown-linux-gnu
22/Dec/2015 15:00:58 [plugin.c:1000] 0 plugin(s) enabled
22/Dec/2015 15:00:58 [nprobe.c:6203] Non IPv4/v6 traffic is discarded according to the template
22/Dec/2015 15:00:58 [util.c:287] GeoIP: loaded AS config file /usr/share/ntopng/httpdocs/geoip/GeoIPASNum.dat
22/Dec/2015 15:00:58 [util.c:296] GeoIP: loaded AS IPv6 config file /usr/share/ntopng/httpdocs/geoip/GeoIPASNumv6.dat
22/Dec/2015 15:00:58 [nprobe.c:5121] Using packet capture length 128
22/Dec/2015 15:00:58 [nprobe.c:6698] IPv6 traffic will NOT be exported/accounted by this probe
22/Dec/2015 15:00:58 [nprobe.c:6699] due to configuration options (e.g. use NetFlow v9)
22/Dec/2015 15:00:58 [nprobe.c:6827] Not capturing packet from interface (collector mode)
22/Dec/2015 15:00:58 [util.c:3840] Succesfully created ZMQ endpoint tcp://_:5556
22/Dec/2015 15:00:58 [collect.c:145] Flow collector listening on port 2056 (IPv4/v6)
22/Dec/2015 15:00:58 [nprobe.c:7035] nProbe started successfully

**Comment by lucaderi** [comment]
You need to use tcp://*:5556

**Comment by WarrenOpus** [comment]
OK... I have 8 netflow senders..
I have the ntopng and nprobe on the same server. 
Various netflow sources send to my server on port 2055, 2056, 2057, 2058, 2060, 2061, 2063, 2064...
So based on this I have removed the port after --collector-port... (even though this previously worked)
Here's now how I now start my probes... 
nprobe --zmq "tcp://*:2055" -i none -n none --collector-port &
nprobe --zmq "tcp://*:2056" -i none -n none --collector-port &
nprobe --zmq "tcp://*:2057" -i none -n none --collector-port &
nprobe --zmq "tcp://*:2058" -i none -n none --collector-port &
nprobe --zmq "tcp://*:2060" -i none -n none --collector-port &
nprobe --zmq "tcp://*:2061" -i none -n none --collector-port &
nprobe --zmq "tcp://*:2063" -i none -n none --collector-port &
nprobe --zmq "tcp://*:2064" -i none -n none --collector-port &

Now I can see no traffic at all, for any networks.

**Comment by lucaderi** [comment]
now you missed the collection port

**Comment by WarrenOpus** [comment]
Ok, back to my original commands...
The only difference is that the tcp://*5555 is now "tcp://5555"..... 

nprobe --zmq "tcp://_:5555" -i none -n none --collector-port 2055 &
nprobe --zmq "tcp://_:5556" -i none -n none --collector-port 2056 &
nprobe --zmq "tcp://_:5557" -i none -n none --collector-port 2057 &
nprobe --zmq "tcp://_:5558" -i none -n none --collector-port 2058 &
nprobe --zmq "tcp://_:5560" -i none -n none --collector-port 2060 &
nprobe --zmq "tcp://_:5561" -i none -n none --collector-port 2061 &
nprobe --zmq "tcp://_:5563" -i none -n none --collector-port 2063 &
nprobe --zmq "tcp://_:5564" -i none -n none --collector-port 2064 &

Now on NTOPNG only seeing traffic from one collector..... all others report No data available. 
If I do each one manually, it will show, but when I use multiple.... there is a problem.

**Comment by WarrenOpus** [comment]
![ntop-screenshot](https://cloud.githubusercontent.com/assets/3367520/11951030/59617c6e-a8c0-11e5-9eba-53ec2655f692.png)

nothing showing for any of the collectors. It's always intermittent. At least 3 of the networks are 24/7 and are always emitting netflow streams from the firewalls. 
I can generally get them to work on their own, but never together....

**Comment by WarrenOpus** [comment]
Makes no difference to messages, with or without ""... in fact I cannot get mine to generate an error. With or without ""

as you can see it starts without the " " quotes...

/home/nidadmin# nprobe --zmq tcp://*:5555 -i none -n none --collector-port 2055 &
[14] 7584
root@Netflow:/home/nidadmin# 22/Dec/2015 15:36:05 [nprobe.c:3130] Valid nProbe license found
22/Dec/2015 15:36:05 [nprobe.c:4488] WARNING: The output interfaceId is set to 0: did you forget to use -Q perhaps ?
22/Dec/2015 15:36:05 [nprobe.c:4491] WARNING: The input interfaceId is set to 0: did you forget to use -u perhaps ?
22/Dec/2015 15:36:06 [nprobe.c:4552] Welcome to nProbe v.7.2.151204 ($Revision: 4471 $) for x86_64-unknown-linux-gnu with native PF_RING acceleration
22/Dec/2015 15:36:06 [nprobe.c:4562] Running on Ubuntu 14.04.2 LTS
22/Dec/2015 15:36:06 [nprobe.c:4573] [LICENSE] nProbe SystemId: 4A831FDA09B1B8A9
22/Dec/2015 15:36:06 [nprobe.c:4584] [LICENSE] nProbe License:  D019F625A5EF737A281CCCFDD6CEA1BE1481341730C2268813
22/Dec/2015 15:36:06 [nprobe.c:4587] [LICENSE] nProbe Edition:  Standard [without PF_RING Acceleration]
22/Dec/2015 15:36:06 [nprobe.c:4614] [LICENSE] Maintenance is available until Sat Dec 10 10:48:50 2016 [353 days left]
22/Dec/2015 15:36:06 [nprobe.c:6526] Welcome to nprobe v.7.2.151204 for x86_64-unknown-linux-gnu
22/Dec/2015 15:36:06 [plugin.c:1000] 0 plugin(s) enabled
22/Dec/2015 15:36:06 [nprobe.c:6203] Non IPv4/v6 traffic is discarded according to the template
22/Dec/2015 15:36:06 [util.c:287] GeoIP: loaded AS config file /usr/share/ntopng/httpdocs/geoip/GeoIPASNum.dat
22/Dec/2015 15:36:06 [util.c:296] GeoIP: loaded AS IPv6 config file /usr/share/ntopng/httpdocs/geoip/GeoIPASNumv6.dat
22/Dec/2015 15:36:06 [nprobe.c:5121] Using packet capture length 128
22/Dec/2015 15:36:06 [nprobe.c:6698] IPv6 traffic will NOT be exported/accounted by this probe
22/Dec/2015 15:36:06 [nprobe.c:6699] due to configuration options (e.g. use NetFlow v9)
22/Dec/2015 15:36:06 [nprobe.c:6827] Not capturing packet from interface (collector mode)
22/Dec/2015 15:36:06 [util.c:3840] Succesfully created ZMQ endpoint tcp://*:5555
22/Dec/2015 15:36:06 [collect.c:145] Flow collector listening on port 2055 (IPv4/v6)
22/Dec/2015 15:36:06 [nprobe.c:7035] nProbe started successfully

and starts with " " 

# nprobe --zmq "tcp://*:5555" -i none -n none --collector-port 2055 &
[14] 7618
root@Netflow:/home/nidadmin# 22/Dec/2015 15:37:52 [nprobe.c:3130] Valid nProbe license found
22/Dec/2015 15:37:52 [nprobe.c:4488] WARNING: The output interfaceId is set to 0: did you forget to use -Q perhaps ?
22/Dec/2015 15:37:52 [nprobe.c:4491] WARNING: The input interfaceId is set to 0: did you forget to use -u perhaps ?
22/Dec/2015 15:37:52 [nprobe.c:4552] Welcome to nProbe v.7.2.151204 ($Revision: 4471 $) for x86_64-unknown-linux-gnu with native PF_RING acceleration
22/Dec/2015 15:37:52 [nprobe.c:4562] Running on Ubuntu 14.04.2 LTS
22/Dec/2015 15:37:52 [nprobe.c:4573] [LICENSE] nProbe SystemId: 4A831FDA09B1B8A9
22/Dec/2015 15:37:52 [nprobe.c:4584] [LICENSE] nProbe License:  D019F625A5EF737A281CCCFDD6CEA1BE1481341730C2268813
22/Dec/2015 15:37:52 [nprobe.c:4587] [LICENSE] nProbe Edition:  Standard [without PF_RING Acceleration]
22/Dec/2015 15:37:52 [nprobe.c:4614] [LICENSE] Maintenance is available until Sat Dec 10 10:48:50 2016 [353 days left]
22/Dec/2015 15:37:52 [nprobe.c:6526] Welcome to nprobe v.7.2.151204 for x86_64-unknown-linux-gnu
22/Dec/2015 15:37:52 [plugin.c:1000] 0 plugin(s) enabled
22/Dec/2015 15:37:52 [nprobe.c:6203] Non IPv4/v6 traffic is discarded according to the template
22/Dec/2015 15:37:52 [util.c:287] GeoIP: loaded AS config file /usr/share/ntopng/httpdocs/geoip/GeoIPASNum.dat
22/Dec/2015 15:37:52 [util.c:296] GeoIP: loaded AS IPv6 config file /usr/share/ntopng/httpdocs/geoip/GeoIPASNumv6.dat
22/Dec/2015 15:37:52 [nprobe.c:5121] Using packet capture length 128
22/Dec/2015 15:37:52 [nprobe.c:6698] IPv6 traffic will NOT be exported/accounted by this probe
22/Dec/2015 15:37:52 [nprobe.c:6699] due to configuration options (e.g. use NetFlow v9)
22/Dec/2015 15:37:52 [nprobe.c:6827] Not capturing packet from interface (collector mode)
22/Dec/2015 15:37:52 [util.c:3840] Succesfully created ZMQ endpoint tcp://*:5555
22/Dec/2015 15:37:52 [collect.c:145] Flow collector listening on port 2055 (IPv4/v6)
22/Dec/2015 15:37:52 [nprobe.c:7035] nProbe started successfully

**Comment by simonemainardi** [comment]
Hi, I've just tested ntopng with 8 nprobe instances (3.16.0-51-generic #69~14.04.1-Ubuntu SMP Wed Oct 7 15:32:41 UTC 2015 x86_64 x86_64 x86_64 GNU/Linux). Everything works as expected an ntopng is able to properly collect flows from each nprobe simultaneously

![image](https://cloud.githubusercontent.com/assets/3397663/11957842/67efcd68-a8c4-11e5-90b7-ab3cb792cd35.png)

The only differences in my setup are:
- I am executing nprobes as: `nprobe --zmq tcp://*:5555` (so no collector mode)
- I cut&pasted your ntopng config and replaced ip addresses with 127.0.0.1 (ntopng and nprobes are running on the same host)

I argue this may be an nprobe issue. Are you sure you can execute nprobe as `nprobe --zmq "tcp://*:5555" -i none -n none --collector-port 2055`? I am not nprobe savvy but a quick `nprobe --help` says that if you specify -n none, then no flow will be export.

```
[--collector|-n] <host:port|none>   | Address of the NetFlow collector(s).
                                    | Multiple collectors can be defined using
                                    | multiple -n flags. In this case flows
                                    | will be sent in round robin mode to
                                    | all defined collectors if the -a flag
                                    | is used. Note that you can specify
                                    | both IPv4 and IPv6 addresses.
                                    | If you specify none as value,
                                    | no flow will be export; in this case
                                    | the -P parameter is mandatory.
                                    | Note that you can specify the protocol
                                    | used to send packets. Example:
                                    | udp://192.168.0.1:2055,tcp://10.1.2.3:2055

```

also try and use tcpdump to see if there is some tcp traffic exchanged over zmq.

**Comment by WarrenOpus** [comment]
yes it starts... and yes it does produce output to ntopng, but you can't run multiple instances... (this is my problem)

# nprobe --zmq "tcp://*:5555" -i none -n none --collector-port 2055

23/Dec/2015 09:38:36 [nprobe.c:3130] Valid nProbe license found
23/Dec/2015 09:38:36 [nprobe.c:4488] WARNING: The output interfaceId is set to 0: did you forget to use -Q perhaps ?
23/Dec/2015 09:38:36 [nprobe.c:4491] WARNING: The input interfaceId is set to 0: did you forget to use -u perhaps ?
23/Dec/2015 09:38:36 [nprobe.c:4552] Welcome to nProbe v.7.2.151211 ($Revision: 4471 $) for x86_64-unknown-linux-gnu with native PF_RING acceleration
23/Dec/2015 09:38:36 [nprobe.c:4562] Running on Ubuntu 14.04.2 LTS
23/Dec/2015 09:38:36 [nprobe.c:4573] [LICENSE] nProbe SystemId: 4A831FDA09B1B8A9
23/Dec/2015 09:38:36 [nprobe.c:4584] [LICENSE] nProbe License:  D019F625A5EF737A281CCCFDD6CEA1BE1481341730C2268813
23/Dec/2015 09:38:36 [nprobe.c:4587] [LICENSE] nProbe Edition:  Standard [without PF_RING Acceleration]
23/Dec/2015 09:38:36 [nprobe.c:4614] [LICENSE] Maintenance is available until Sat Dec 10 10:48:50 2016 [353 days left]
23/Dec/2015 09:38:36 [nprobe.c:6526] Welcome to nprobe v.7.2.151211 for x86_64-unknown-linux-gnu
23/Dec/2015 09:38:36 [plugin.c:1000] 0 plugin(s) enabled
23/Dec/2015 09:38:36 [nprobe.c:6203] Non IPv4/v6 traffic is discarded according to the template
23/Dec/2015 09:38:36 [util.c:287] GeoIP: loaded AS config file /usr/share/ntopng/httpdocs/geoip/GeoIPASNum.dat
23/Dec/2015 09:38:36 [util.c:296] GeoIP: loaded AS IPv6 config file /usr/share/ntopng/httpdocs/geoip/GeoIPASNumv6.dat
23/Dec/2015 09:38:36 [nprobe.c:5121] Using packet capture length 128
23/Dec/2015 09:38:36 [nprobe.c:6698] IPv6 traffic will NOT be exported/accounted by this probe
23/Dec/2015 09:38:36 [nprobe.c:6699] due to configuration options (e.g. use NetFlow v9)
23/Dec/2015 09:38:36 [nprobe.c:6827] Not capturing packet from interface (collector mode)
23/Dec/2015 09:38:36 [util.c:3840] Succesfully created ZMQ endpoint tcp://*:5555
23/Dec/2015 09:38:36 [collect.c:145] Flow collector listening on port 2055 (IPv4/v6)
23/Dec/2015 09:38:36 [nprobe.c:7035] nProbe started successfully

**Comment by WarrenOpus** [comment]
I have 8 remote firewalls, they all send netflow streams to 192.168.13.7 on different ports (2055, 2056 etc..)
I have 1 server. It must run ntopng and nprobes on the same machine. 
How do you suggest I configure it?

**Comment by WarrenOpus** [comment]
Ok I started them like this
nprobe --zmq "tcp://*:2055" &
Ok, I started them like this

nprobe --zmq "tcp://*:2056" &
nprobe --zmq "tcp://*:2057" &
nprobe --zmq "tcp://*:2058" &
nprobe --zmq "tcp://*:2060" &
nprobe --zmq "tcp://*:2061" &
nprobe --zmq "tcp://*:2063" &
nprobe --zmq "tcp://*:2064" &

and I changed the ntopng.conf to use 127.0.0.1 (not the LAN IP)

Thanks for you help. I will add this as an example config to the email list. 
Thanks again.

**Comment by WarrenOpus** [comment]
![nflowtalkers](https://cloud.githubusercontent.com/assets/3367520/11970690/1990b198-a962-11e5-8073-48f946c7b895.png)

I must be doing something wrong. I have selected the interface tcp:127.0.0.1 a.k.a VTE..

these top talkers are incorrect, there is no way these are talking to this LAN. Infact not a single IP address in this LAN (VTE) 192.168.0.0/24 show up in top talkers when this interface is selected. 
No matter which interface I select the same top talkers show up.... 

Current config: 
ntopng.conf
-i=tcp://127.0.0.1:2055
-i=tcp://127.0.0.1:2056
-i=tcp://127.0.0.1:2057
-i=tcp://127.0.0.1:2058
-i=tcp://127.0.0.1:2060
-i=tcp://127.0.0.1:2061
-i=tcp://127.0.0.1:2063
-i=tcp://127.0.0.1:2064

nprobes started like you suggested 
nprobe --zmq "tcp://_:2055" &
nprobe --zmq "tcp://_:2056" &
nprobe --zmq "tcp://_:2057" &
nprobe --zmq "tcp://_:2058" &
nprobe --zmq "tcp://_:2060" &
nprobe --zmq "tcp://_:2061" &
nprobe --zmq "tcp://_:2063" &
nprobe --zmq "tcp://_:2064" &

Should this config allow me to see _only_ the traffc from the LAN behind the firewall that is sending the netflow stream? 
e.g. if I select interface -i=tcp://127.0.0.1:2055 I will only see traffic on the dashboard related to the netflow stream being sent from that LAN? 

Thanks,
Warren

**Comment by WarrenOpus** [comment]
Currently this is the only way I can get close to what I want to achieve: 
_This is my original configuration_ So I am back to where I started! 

ntopng.conf
-i=tcp://127.0.0.1:5555
-i=tcp://127.0.0.1:5556
-i=tcp://127.0.0.1:5557
-i=tcp://127.0.0.1:5558
-i=tcp://127.0.0.1:5560
-i=tcp://127.0.0.1:5561
-i=tcp://127.0.0.1:5563
-i=tcp://127.0.0.1:5564

I have started the nprobes like this ( and they start without any errors!)
nprobe --zmq "tcp://_:5555" -i none -n none --collector-port 2055 &
nprobe --zmq "tcp://_:5556" -i none -n none --collector-port 2056 &
nprobe --zmq "tcp://_:5557" -i none -n none --collector-port 2057 &
nprobe --zmq "tcp://_:5558" -i none -n none --collector-port 2058 &
nprobe --zmq "tcp://_:5560" -i none -n none --collector-port 2060 &
nprobe --zmq "tcp://_:5561" -i none -n none --collector-port 2061 &
nprobe --zmq "tcp://_:5563" -i none -n none --collector-port 2063 &
nprobe --zmq "tcp://_:5564" -i none -n none --collector-port 2064 &

We know the remote Cisco firewalls are sending netflow streams to this machine!
#tcpdump port 2056 or 2057 or 2058 or 2059 or 2060 or 2061 or 2063 or 2064
listening on eth1, link-type EN10MB (Ethernet), capture size 65535 bytes
11:24:38.471871 IP 192.168.13.254.16124 > 192.168.13.7.2055: UDP, length 1416
11:24:38.477276 IP 192.168.0.1.16724 > 192.168.13.7.2057: UDP, length 1416
11:24:38.589122 IP 192.168.1.2.57365 > 192.168.13.7.2061: UDP, length 1424
11:24:38.613599 IP 192.168.15.254.1959 > 192.168.13.7.2063: UDP, length 1460
11:24:39.229532 IP 192.168.18.254.64811 > 192.168.13.7.2058: UDP, length 1444
11:24:39.878737 IP 192.168.50.254.16608 > 192.168.13.7.2056: UDP, length 1424
11:24:40.342502 IP 192.168.41.254.52922 > 192.168.13.7.2060: UDP, length 1452
11:24:40.643141 IP 192.168.15.254.1959 > 192.168.13.7.2063: UDP, length 1472
11:24:40.664972 IP 192.168.31.250.43411 > 192.168.13.7.2064: UDP, length 1004
11:24:40.952257 IP 192.168.50.254.16608 > 192.168.13.7.2056: UDP, length 1432

Here is a screen shoot to prove I can see only traffic for that remote OFFICE LAN - so this works fine!
![unique-to-lan](https://cloud.githubusercontent.com/assets/3367520/11971016/896ed8a4-a968-11e5-95d0-1cb3c451fc51.png)

However, only 5 interfaces show traffic. 
tcp://127.0.0.1:5555
tcp://127.0.0.1:5557
tcp://127.0.0.1:5561
tcp://127.0.0.1:5563
tcp://127.0.0.1:5564

![5nets](https://cloud.githubusercontent.com/assets/3367520/11971061/66d88866-a969-11e5-9d07-ee2c1fe09c7b.png)

So let's investigate why the following interfaces show NO DATA AVAILABLE
tcp://127.0.0.1:5556
tcp://127.0.0.1:5558
tcp://127.0.0.1:5560

We see netflow packets arrive 

# tcpdump port 2056

tcpdump: verbose output suppressed, use -v or -vv for full protocol decode
listening on eth1, link-type EN10MB (Ethernet), capture size 65535 bytes
11:38:49.099239 IP 192.168.50.254.16608 > 192.168.13.7.2056: UDP, length 1472
11:38:50.388203 IP 192.168.50.254.16608 > 192.168.13.7.2056: UDP, length 1416

# tcpdump port 2058

tcpdump: verbose output suppressed, use -v or -vv for full protocol decode
listening on eth1, link-type EN10MB (Ethernet), capture size 65535 bytes
11:39:50.221284 IP 192.168.18.254.64811 > 192.168.13.7.2058: UDP, length 1412
11:39:50.580270 IP 192.168.18.254.64811 > 192.168.13.7.2058: UDP, length 1420

# tcpdump port 2060

tcpdump: verbose output suppressed, use -v or -vv for full protocol decode
listening on eth1, link-type EN10MB (Ethernet), capture size 65535 bytes
11:40:16.664767 IP 192.168.41.254.52922 > 192.168.13.7.2060: UDP, length 1460
11:40:18.094026 IP 192.168.41.254.52922 > .2060: UDP, length 1472

So I use tcpdump to see if the nprobe is sending data to ntopng...
tcpdump -i lo  port 5556 or 5558 or 5560
tcpdump: verbose output suppressed, use -v or -vv for full protocol decode
listening on lo, link-type EN10MB (Ethernet), capture size 65535 bytes

*\* and we can see nothing **

if we try another interface that is working we can see packets between nprobe and ntopng

# tcpdump -i lo  port 5555

tcpdump: verbose output suppressed, use -v or -vv for full protocol decode
listening on lo, link-type EN10MB (Ethernet), capture size 65535 bytes
11:44:18.156055 IP localhost.5555 > localhost.38709: Flags [P.], seq 3782777354:3782785546, ack 3751585141, win 342, options [nop,nop,TS val 2010413 ecr 2010126], length 8192
11:44:18.156065 IP localhost.38709 > localhost.5555: Flags [.], ack 8192, win 18387, options [nop,nop,TS val 2010413 ecr 2010413], length 0

So let's see if the nprobe is starting correctly for one of the interfaces that shows No data available.
And it starts fine using this command...

nprobe --verbose 2 --zmq "tcp://*:5556" -i none -n none --collector-port 2056 &
![nprobestart](https://cloud.githubusercontent.com/assets/3367520/11971154/f6c9132c-a96a-11e5-8ccd-d5f7f900d142.png)

So the 3 networks that send traffic to port 2056, 2058 and 2060 are using Cisco IOS 8.2 on 5510 firewalls... that's the only thing I can see might be causing the issue with the netflow stream? 
All the others are IOS 8.4 or 9.1

to recap what I want to do:

A) Monitor traffic at remote offices. 
B) The ability to login to NTOPNG and select an interface PER office. 
C) Only see traffic for that office (not aggregated traffic etc..)

The configs at this top of the message work, it's just that 3 interfaces do not show traffic even though Netflow packets are arriving... wondering how I can fault find further? 

Thanks.

**Comment by simonemainardi** [comment]
thanks for the detailed investigation carried out. I don't think this is an ntopng issue. More likely, this is something related to nprobe that is not able to communicate over zmq with ntopng.

You have already seen traffic from the CISCOs to the nprobes via tcpdump and this is fine. Could you please shut down one of the three nprobes bound to ports 5556 or 5558 or 5560, and see the console output. It should write out statistics on the collected traffic, e.g., 

```
11/Dec/2015 23:56:51 [nprobe.c:2512] Flow export stats: [0 bytes/0 pkts][0 flows/0 pkts sent]
11/Dec/2015 23:56:51 [nprobe.c:2519] Flow collection: [collected pkts: 543][processed flows: 2395]
11/Dec/2015 23:56:51 [nprobe.c:2522] Flow drop stats: [0 bytes/0 pkts][0 flows]
11/Dec/2015 23:56:51 [nprobe.c:2527] Total flow stats: [0 bytes/0 pkts][0 flows/0 pkts sent]
```

You should check that traffic statistics are greater than zero. This is to make sure nprobe correctly process traffic it receives from the cisco.

let me know.

**Comment by WarrenOpus** [comment]
Only ran them for a few minutes... so not sure they were on long enough. Receiving packets.... but no processing. 

24/Dec/2015 16:40:04 [nprobe.c:386] Received shutdown request... [signal: 2]
24/Dec/2015 16:40:04 [nprobe.c:4716] nProbe is shutting down...
24/Dec/2015 16:40:04 [nprobe.c:4752] Exporting pending buckets...
24/Dec/2015 16:40:04 [nprobe.c:4773] Pending buckets have been exported...
24/Dec/2015 16:40:06 [engine.c:3293] Export thread terminated [exportQueue=0]
24/Dec/2015 16:40:06 [nprobe.c:4839] Flushing queued flows...
24/Dec/2015 16:40:06 [nprobe.c:4842] Freeing memory...
24/Dec/2015 16:40:06 [plugin.c:277] Terminating plugins.
24/Dec/2015 16:40:06 [cache.c:1200] Redis Cache [0 total/0.0 get/sec][0 total/0.0 set/sec]
24/Dec/2015 16:40:06 [nprobe.c:4934] Still allocated 0 hash buckets
24/Dec/2015 16:40:06 [nprobe.c:2457] Processed packets: 0 (max bucket search: 0)
24/Dec/2015 16:40:06 [nprobe.c:2440] Fragment queue length: 0
24/Dec/2015 16:40:06 [nprobe.c:2466] Flow export stats: [0 bytes/0 pkts][0 flows/0 pkts sent]
24/Dec/2015 16:40:06 [nprobe.c:2473] Flow collection: [collected pkts: 287][processed flows: 0]
24/Dec/2015 16:40:06 [nprobe.c:2476] Flow drop stats:   [0 bytes/0 pkts][0 flows]
24/Dec/2015 16:40:06 [nprobe.c:2481] Total flow stats:  [0 bytes/0 pkts][0 flows/0 pkts sent]
24/Dec/2015 16:40:06 [nprobe.c:4947] Cleaning globals
24/Dec/2015 16:40:06 [nprobe.c:4967] nProbe terminated.

24/Dec/2015 16:45:16 [nprobe.c:386] Received shutdown request... [signal: 2]
24/Dec/2015 16:45:19 [cache.c:1200] Redis Cache [0 total/0.0 get/sec][0 total/0.0 set/sec]
24/Dec/2015 16:45:19 [nprobe.c:2457] Processed packets: 0 (max bucket search: 0)
24/Dec/2015 16:45:19 [nprobe.c:2440] Fragment queue length: 0
24/Dec/2015 16:45:19 [nprobe.c:2466] Flow export stats: [0 bytes/0 pkts][0 flows/0 pkts sent]
24/Dec/2015 16:45:19 [nprobe.c:2473] Flow collection: [collected pkts: 168][processed flows: 0]
24/Dec/2015 16:45:19 [nprobe.c:2476] Flow drop stats:   [0 bytes/0 pkts][0 flows]
24/Dec/2015 16:45:19 [nprobe.c:2481] Total flow stats:  [0 bytes/0 pkts][0 flows/0 pkts sent]

**Comment by simonemainardi** [comment]
We can confirm this one is an nProbe issue. You should file an issue here https://github.com/ntop/nProbe/issues. Please post important details such as IOS and nprobe versions, as well as nprobe startup string.

Also try and experiment with nprobe to see if you can understand why received data is not processed. I think this may be just a minor configuration issue.

Closing.
