### ISSUE TITLE
Radius Authentication failure[-1] on Debian 11 (ntopng dev 5.5)

### ISSUE THREAD

**Issue by firengate** [ntop/ntopng#6987]
**Environment**:
* OS name: Debian 11 (in docker) + also tried the official ntopng image
* OS version: 11
* Architecture: amd64
* ntopng version/revision: 5.5.221105

**What happened**:
Radius authorization does not work. Radius packets are not generated by ntopng. Based on the error code, the problem is internal, so radius packets are not generated. 

**Debug Information**:
tcpdump does not capture packets
root@284a2c53e5a6:/# tcpdump port 1812
tcpdump: verbose output suppressed, use -v[v]... for full protocol decode
listening on eth0, link-type EN10MB (Ethernet), snapshot length 262144 bytes

The libradcli library is installed.
root@284a2c53e5a6:/# apt install libradcli4
Reading package lists... Done
Building dependency tree... Done
Reading state information... Done
libradcli4 is already the newest version (1.2.11-1+b2).
libradcli4 set to manually installed.
0 upgraded, 0 newly installed, 0 to remove and 0 not upgraded.

message from ntopng log
24/Nov/2022 18:08:50 [Ntop.cpp:1651] WARNING: Radius Authentication failure[-1]: user "aaaaaaaaaa"

radius settings in redis
/data # echo 'keys *radius*' | redis-cli | sed 's/^/get /' | redis-cli
"pass"
"1"
"192.168.110.3:1812"
"admin"

**Comment by MatteoBiscosi** [comment]
Hi @remackad did you follow this documentation regarding RADIUS auth? 
https://www.ntop.org/guides/ntopng/advanced_features/authentication.html?highlight=radius

**Comment by cardigliano** [comment]
It seems to be working for me (Ubuntu 22) using latest dev. 

I was using this test server: https://idblender.com/tools/public-radius

Please make sure tcpdump is using the correct interface (please specify it)

$ sudo tcpdump -ni eno1 port 1812
listening on eno1, link-type EN10MB (Ethernet), snapshot length 262144 bytes
19:25:23.680711 IP 192.168.2.134.51986 > 212.24.98.232.1812: RADIUS, Access-Request (1), id: 0x9d length: 60
19:25:23.731945 IP 212.24.98.232.1812 > 192.168.2.134.51986: RADIUS, Access-Accept (2), id: 0x9d length: 30

**Comment by firengate** [comment]
> Hi @remackad did you follow this documentation regarding RADIUS auth? https://www.ntop.org/guides/ntopng/advanced_features/authentication.html?highlight=radius

Hi! Of course I did.

> It seems to be working for me (Ubuntu 22) using latest dev.
> 
> I was using this test server: https://idblender.com/tools/public-radius
> 
> Please make sure tcpdump is using the correct interface (please specify it)
> 
> $ sudo tcpdump -ni eno1 port 1812 listening on eno1, link-type EN10MB (Ethernet), snapshot length 262144 bytes 19:25:23.680711 IP 192.168.2.134.51986 > 212.24.98.232.1812: RADIUS, Access-Request (1), id: 0x9d length: 60 19:25:23.731945 IP 212.24.98.232.1812 > 192.168.2.134.51986: RADIUS, Access-Accept (2), id: 0x9d length: 30

Okay, here.

root@284a2c53e5a6:/# ip ad
1: lo: <LOOPBACK,UP,LOWER_UP> mtu 65536 qdisc noqueue state UNKNOWN group default qlen 1000
    link/loopback 00:00:00:00:00:00 brd 00:00:00:00:00:00
    inet 127.0.0.1/8 scope host lo
       valid_lft forever preferred_lft forever
186: eth0@if187: <BROADCAST,MULTICAST,UP,LOWER_UP> mtu 1500 qdisc noqueue state UP group default
    link/ether 02:42:0a:c8:01:64 brd ff:ff:ff:ff:ff:ff link-netnsid 0
    inet 10.200.1.100/24 brd 10.200.1.255 scope global eth0
       valid_lft forever preferred_lft forever
root@284a2c53e5a6:/# tcpdump port 1812 -ni eth0
tcpdump: verbose output suppressed, use -v[v]... for full protocol decode
listening on eth0, link-type EN10MB (Ethernet), snapshot length 262144 bytes
^C
0 packets captured
0 packets received by filter
0 packets dropped by kernel

25/Nov/2022 02:00:33 [Ntop.cpp:1520] Checking RADIUS auth
25/Nov/2022 02:00:33 [Ntop.cpp:1618] Radius: performing auth for user asdsadsadas
25/Nov/2022 02:00:33 [Ntop.cpp:1651] WARNING: Radius Authentication failure[-1]: user "asdsadsadas"

An error code of -1 means, as far as I know, that the problem occurred before the request was sent. It's not a timeout and it's not a rejection. libradcli installed, what else could affect it?

**Comment by cardigliano** [comment]
Please provide the output of "apt list libradcli4" and a screenshot of the Preferences -> RADIUS Authentication section.

**Comment by firengate** [comment]
root@284a2c53e5a6:/# apt list libradcli4
Listing... Done
libradcli4/stable,now 1.2.11-1+b2 amd64 [installed]

![image](https://user-images.githubusercontent.com/25734655/203995479-98b1b9c1-4906-47f6-8c5e-48fb0e05b63d.png)

**Comment by firengate** [comment]
Can you check the RADIUS authorization in your docker image?

**Comment by cardigliano** [comment]
Did you use ntop/ntopng:latest (from Dockerhub)?

**Comment by cardigliano** [comment]
I tried with this command below right now, radius authentication seems to be working with this docker image as well (using this public server to test it https://idblender.com/tools/public-radius)

sudo docker run -it -p 3000:3000 -v /etc/ntopng.license:/etc/ntopng.license:ro --net=host ntop/ntopng:latest

**Comment by firengate** [comment]
> I tried with this command below right now, radius authentication seems to be working with this docker image as well (using this public server to test it https://idblender.com/tools/public-radius)
> 
> sudo docker run -it -p 3000:3000 -v /etc/ntopng.license:/etc/ntopng.license:ro --net=host ntop/ntopng:latest

On the official image of version 5.4 it works.
I built an image based on Debian 11 and ntopng 5.5. Can you please check on Debian and ntopng dev version?

My Dockerfile:

FROM debian:bullseye

# skip interactive configuration dialogs
ENV DEBIAN_FRONTEND noninteractive

RUN apt update && apt install -y --no-install-recommends curl gnupg ca-certificates dirmngr apt-transport-https && \
        echo "deb http://packages.ntop.org/apt/bullseye/ x64/" >> /etc/apt/sources.list.d/ntop.list && \
        echo "deb http://packages.ntop.org/apt/bullseye/ all/" >> /etc/apt/sources.list.d/ntop.list && \
        curl -sSL http://packages.ntop.org/apt/ntop.key | apt-key add - && \
        echo "deb https://packages.clickhouse.com/deb stable main" > /etc/apt/sources.list.d/clickhouse.list && \
        apt-key adv --keyserver hkp://keyserver.ubuntu.com:80 --recv 8919F6BD2B48D754 && \
        apt update && apt install -y --no-install-recommends ntopng libelf1 clickhouse-client && \
        apt clean all && apt autoclean && apt clean && apt autoremove -y --purge && rm -rf /var/lib/{apt,dpkg,cache,log}

**Comment by cardigliano** [comment]
I ran a test on Debian 11 using a similar dockerfile that you can download from our github, this also seems to be working for me:

1. wget https://raw.githubusercontent.com/ntop/docker-ntop/master/Dockerfile.ntopng.debian11.dev
2. docker build -t ntopng -f Dockerfile.ntopng.debian11.dev .
3. docker run -it --net=host -v /etc/ntopng.license:/etc/ntopng.license ntopng -i eno1

**Comment by firengate** [comment]
With your Dockerfile it works. Thank you very much! As far as I could understand, it is necessary to install the apt-ntop.deb package. Maybe it's something else, but either way it works.

**Comment by cardigliano** [comment]
Great, thank you for the update
