### ISSUE TITLE
Active Directory link not working

### ISSUE THREAD

**Issue by hgpit** [ntop/ntopng#1861]
ntopng Enterprise Edition v.3.5.180716 on CentOS 7

There seems to be something very buggy with the LDAP/AD integration. Or we're grossly misunderstanding how it works.

Now, originally we had a handful of local DB users. user1, user2, user3, user4, user5.
They could login fine.

Then we changed ntopng to use LDAP (only, not local/LDAP hybrid) and deleted all the existing users from the local DB.

We configured our LDAP for Active Directory. All settings looked fine. We have AD groups **ntopng_users** and **ntopng_admins** for the AD groups and have assigned our AD users accordingly.

Now, users who originally existed in the local DB (now deleted) can login okay. But any users who were never in the local DB are unable to login. How does this make sense?!

If I run tcpdump on our ntopng server (svr-h003349) I can see a conversation between our AD domain controller (dc4) when a user attempts to login to ntopng:

```
14:36:12.325331 IP svr-h003349.xxxxx-group.local.55474 > dc4.xxxxx-group.local.ldap: Flags [P.], seq 189:264, ack 675, win 239, options [nop,nop,TS val 78213968 ecr 96533776], length 75
14:36:12.349614 IP dc4.xxxxx-group.local.ldap > svr-h003349.xxxxx-group.local.55474: Flags [P.], seq 675:785, ack 264, win 259, options [nop,nop,TS val 96533779 ecr 78213968], length 110
14:36:12.349673 IP svr-h003349.xxxxx-group.local.55474 > dc4.xxxxx-group.local.ldap: Flags [P.], seq 264:271, ack 785, win 239, options [nop,nop,TS val 78213992 ecr 96533779], length 7
14:36:12.349680 IP svr-h003349.xxxxx-group.local.55474 > dc4.xxxxx-group.local.ldap: Flags [F.], seq 271, ack 785, win 239, options [nop,nop,TS val 78213992 ecr 96533779], length 0
14:36:12.349768 IP dc4.xxxxx-group.local.ldap > svr-h003349.xxxxx-group.local.55474: Flags [.], ack 272, win 259, options [nop,nop,TS val 96533779 ecr 78213992], length 0
14:36:12.349828 IP dc4.xxxxx-group.local.ldap > svr-h003349.xxxxx-group.local.55474: Flags [R.], seq 785, ack 272, win 0, length 0
```

So I know the servers are talking. I am getting my Windows guy to look into it further from our AD side, but we have lots of other services running on our network which use AD in this way, so I must admit, I'm suspicious it's more a problem with our ntopng setup or a bug.

Can anyone comment or point out what we may be doing wrong or misunderstanding?

Thank you

**Comment by emanuele-f** [comment]
Hi, with local DB users you mean the ntopng users created via the gui? Have you assigned the users to the groups exactly as explained here https://github.com/ntop/ntopng/blob/dev/doc/README.LDAP#L72 ? Do you see any error in the ntopng log (`journalctl -u ntopng`) after unsuccessful login?

**Comment by hgpit** [comment]
Hi emanuele-f,

Yes, by "local DB" users I do indeed mean ntopng users created via the GUI.
Even though we have now configured ntopng to use LDAP exclusively, and have deleted these users, ntopng still allows their logins - but declines any other user, despite them being in the correct AD group.

Yes, we followed that guide.

**Authentication Method:** LDAP
**Our account type:** sAMAccount
**LDAP Server Address:** ldap://10.11.1.217:389
**LDAP Anonymous Binding:** off
**LDAP Bind DN:** CN=LDAP User,CN=Users,DC=xxxxx-group,DC=local
**LDAP Search Path:** DC=xxxxx-group,DC=local
**LDAP User Group:** ntopng_users
**LDAP Admin Group:** ntopng_admins

I created a brand new AD user, just to test:

```
C:\Users\me>net user ntopnguser /domain
The request will be processed at a domain controller for domain xxxxx-group.local.

User name                    ntopnguser
Full Name                    ntopng User
Comment
User's comment
Country/region code          000 (System Default)
Account active               Yes
Account expires              Never

Password last set            17/07/2018 16:10:58
Password expires             Never
Password changeable          18/07/2018 16:10:58
Password required            Yes
User may change password     Yes

Workstations allowed         All
Logon script
User profile
Home directory
Last logon                   Never

Logon hours allowed          All

Local Group Memberships
Global Group memberships     *Domain Users         *ntopng_users
The command completed successfully.
```

ntopng GUI won't accept the user login creds

I've attached a copy of the journalctl -u ntopng output during the moment a login is attempted.

[ntopng.txt](https://github.com/ntop/ntopng/files/2202275/ntopng.txt)

On a side-note, there's an empty /var/log/ntopng/ntopng.log. No matter what logging level we choose (via the ntopng GUI), this is never populated. ntopng has read/write access to this file.

Thanks

**Comment by hgpit** [comment]
Can you advise if there are any OS dependencies for the LDAP integration which YUM doesn't know about? Maybe we are missing some important LDAP package?

**Comment by emanuele-f** [comment]
This should not be the case, as you can see the LDAP messages in tcpdump. We have to reproduce the environment before being able to advice.

**Comment by hgpit** [comment]
I may have uncovered something useful:

Our AD structure is like this:

![image](https://user-images.githubusercontent.com/16598973/42872824-d3c687f8-8a75-11e8-9952-e4e3e2f64aa5.png)

The majority of our users are buried deep within ROOT -> "xxxxx Group Limited" OU. But we also have users under ROOT -> "Admins" OU etc.

The user we use to bind to AD is "LDAP User", under the ROOT -> "Users" OU.

Now, we have just found that, if a user can't login, we can move the user to the ROOT -> "Users" OU, and they can suddenly login.

This indicates that either
1) ntopng expects all users to be in the same OU where the bind user lives.
and/or
2) The **LDAP Search Path** we provide of  "DC=xxxxx-group,DC=local" is ignored, or child OUs aren't searched.

I hope this helps :)

**Comment by simonemainardi** [comment]
Hi. I'm trying to reproduce without success. If you think it is possible to have (limited) access to your ADDC for debugging, please contact me privately at mainardi ntop org.

Do you see any output in the ntopng log when a login fails?

**Comment by hgpit** [comment]
Hi,

It appears the issue occurs when the OU depth is more than 3. 
For example a user within the 3rd Level OU ( xxxx.local -> xxxx Group Limited -> Department -> Location) works fine.
But a user that sits within (xxxx.local -> xxxx Group Limited -> Department -> Location -> Office) does not.

LDAP logs show users beneath the 4th OU or deeper to come back with authentication error / password incorrect. 

> Internal event: The LDAP server returned an error. 
>  
> Additional Data 
> Error value:
> 80090308: LdapErr: DSID-0C090400, comment: AcceptSecurityContext error, data 52e, v1db1

I hope this helps to replicate the issues we are encountering.

**Comment by hgpit** [comment]
Hi,

I wanted to check if there had been any updates/progress made on this issue? As we are using the enterprise version I also wanted to query whether this is the correct place for this to be raised as opposed to a ticketing system (I am uncertain of the support channels regarding the enterprise version)? 

Many thanks

**Comment by simonemainardi** [comment]
Hi, yes, this is the right place. I'm struggling to reproduce the issue as I don't have system with Active Directory that I can use and for me it works OK with OpenLDAP. Anyway I have a couple of ideas that could fix it. Will submit a tentative fix shortly.

In the meanwhile, kindly help me understand. Did you change anything in the ntopng preferences (e.g., bind dn and search path) between a failed (e.g., 4th OU) and a successful login attempt (r.g., 3rd OU)?

**Comment by simonemainardi** [comment]
I was able to reproduce the issue with very long search paths and bind DN. I have committed a fix. A new build is in progress and will be available in the next couple of hours.

I think that long string could also have affected you with this issue.

Now the code should be able to properly handle search paths and bind DN up to 255 characters. This limit is also checked and enforced from the command line.

Please, report.

**Comment by hgpit** [comment]
Roger Roger, will test this ASAP and report back. Thank you for your continued work on this.

> In the meanwhile, kindly help me understand. Did you change anything in the ntopng preferences (e.g., bind dn and search path) between a failed (e.g., 4th OU) and a successful login attempt (r.g., 3rd OU)?

We didn't change any settings in between these logon attempts.

Many thanks

**Comment by simonemainardi** [comment]
I was wondering if you've had the chance to try the latest version. Please, let me know. Thank you.

**Comment by hgpit** [comment]
Hi simonemainardi,

Sorry for the delay.

Yep, we tested it with the other users in our AD and they all appear to be able to login now.

That fix worked great - thank you so much :-D

**Comment by simonemainardi** [comment]
thanks for reporting!
