### ISSUE TITLE
Cache SNMP Values in Host Location

### ISSUE THREAD

**Issue by lucaderi** [ntop/ntopng#1053]
In case SNMP is configured, ntopng locates hosts on switch ports via SNMP and this info is reported in host_details.lua. To avoid long and un-necessary lookups, it is requested that once a host has been located, its location is stored in redis so that when the page is re-open we simply check if the host is still placed on the same switch port and report, by performing a full scan as today if and only if something changed.

**Comment by simonemainardi** [comment]
implemented in 8e519f5b45f44f6c83629e862111eeda71d6032b and in the Pro part.

**Comment by lucaderi** [comment]
root@pc-deri:/home/deri/nProbe# tcpdump -i any port 161
tcpdump: verbose output suppressed, use -v or -vv for full protocol decode
listening on any, link-type LINUX_SLL (Linux cooked), capture size 262144 bytes
20:20:28.265177 IP deri.ntop.org.55795 > jswitch.ntop.org.snmp:  C="ntop" GetRequest(46)  17.7.1.2.2.1.2.3.100.0.106.99.53.204
20:20:28.270588 IP jswitch.ntop.org.snmp > deri.ntop.org.55795:  C="ntop" GetResponse(40)  noSuchName@1 17.7.1.2.2.1.2.3.100.0.106.99.53.204=
20:20:28.270631 IP deri.ntop.org.50526 > jswitch.ntop.org.snmp:  C="ntop" GetRequest(46)  17.7.1.2.2.1.2.1.100.0.106.99.53.204
20:20:28.276251 IP jswitch.ntop.org.snmp > deri.ntop.org.50526:  C="ntop" GetResponse(40)  noSuchName@1 17.7.1.2.2.1.2.1.100.0.106.99.53.204=
20:20:28.276377 IP deri.ntop.org.46224 > jswitch-p1-b-1.nic.it.snmp:  C="ntop" GetRequest(46)  17.7.1.2.2.1.2.3.100.0.106.99.53.204
20:20:28.281703 IP jswitch-p1-b-1.nic.it.snmp > deri.ntop.org.46224:  C="ntop" GetResponse(40)  noSuchName@1 17.7.1.2.2.1.2.3.100.0.106.99.53.204=
20:20:28.281745 IP deri.ntop.org.55121 > jswitch-p1-b-1.nic.it.snmp:  C="ntop" GetRequest(46)  17.7.1.2.2.1.2.1.100.0.106.99.53.204
20:20:28.287224 IP jswitch-p1-b-1.nic.it.snmp > deri.ntop.org.55121:  C="ntop" GetResponse(40)  noSuchName@1 17.7.1.2.2.1.2.1.100.0.106.99.53.204=
20:20:28.287387 IP deri.ntop.org.43040 > jswitch-p1-a-3.nic.it.snmp:  C="ntop" GetNextRequest(35)  interfaces.ifTable.ifEntry.ifDescr
20:20:28.290115 IP jswitch-p1-a-3.nic.it.snmp > deri.ntop.org.43040:  C="ntop" GetResponse(33)  interfaces.ifTable.ifEntry.ifDescr.4="lsi"
20:20:28.290157 IP deri.ntop.org.47035 > jswitch-p1-a-3.nic.it.snmp:  C="ntop" GetNextRequest(36)  interfaces.ifTable.ifEntry.ifDescr.4
20:20:28.292926 IP jswitch-p1-a-3.nic.it.snmp > deri.ntop.org.47035:  C="ntop" GetResponse(33)  interfaces.ifTable.ifEntry.ifDescr.5="dsc"
20:20:28.292967 IP deri.ntop.org.51544 > jswitch-p1-a-3.nic.it.snmp:  C="ntop" GetNextRequest(36)  interfaces.ifTable.ifEntry.ifDescr.5

It looks caching is not working. Reopening it

**Comment by simonemainardi** [comment]
should be fixed now
