### ISSUE TITLE
ntopng fails to reconnect automatically to redis on disconnect

### ISSUE THREAD

**Issue by charlesboyo** [ntop/ntopng#2253]
Running ntopng on Ubuntu 16.04 with the distro packaged Redis server.
A recent update of the redis-server package caused the redis service to restart.
ntopng detected the disconnection and reported it was reconnecting but that failed to happen though redis was back online and available momentarily. There is no evidence of ntopng actually making a reconnection attempt.

Following were logged by ntopng:
Dec 15 20:59:44 fxtest4 ntopng[692]: 15/Dec/2018 20:59:44 [Redis.cpp:75] Redis has disconnected: reconnecting...
Dec 15 20:59:45 fxtest4 ntopng[692]: 15/Dec/2018 20:59:45 [Redis.cpp:75] Redis has disconnected: reconnecting...

Listening on the loopback interface to tcp/6379 traffic show this:
 3846 17.042275216    127.0.0.1 → 127.0.0.1    TCP 115 55958 → 6379 [PSH, ACK] Seq=147473 Ack=9216 Win=1365 Len=49 TSval=1138885446 TSecr=1138885446
 3847 17.042308106    127.0.0.1 → 127.0.0.1    TCP 71 6379 → 55958 [PSH, ACK] Seq=9216 Ack=147522 Win=2395 Len=5 TSval=1138885446 TSecr=1138885446
 3848 17.084288678    127.0.0.1 → 127.0.0.1    TCP 66 55958 → 6379 [ACK] Seq=147522 Ack=9221 Win=1365 Len=0 TSval=1138885488 TSecr=1138885446
 3849 17.154454935    127.0.0.1 → 127.0.0.1    TCP 66 6379 → 55958 [FIN, ACK] Seq=9221 Ack=147522 Win=2395 Len=0 TSval=1138885558 TSecr=1138885488
 3850 17.154477654    127.0.0.1 → 127.0.0.1    TCP 66 6379 → 55956 [FIN, ACK] Seq=235 Ack=2449 Win=384 Len=0 TSval=1138885558 TSecr=1138884502
 3851 17.196279476    127.0.0.1 → 127.0.0.1    TCP 66 55956 → 6379 [ACK] Seq=2449 Ack=236 Win=1395 Len=0 TSval=1138885600 TSecr=1138885558
 3852 17.196288319    127.0.0.1 → 127.0.0.1    TCP 66 55958 → 6379 [ACK] Seq=147522 Ack=9222 Win=1365 Len=0 TSval=1138885600 TSecr=1138885558
 3853 18.002865252    127.0.0.1 → 127.0.0.1    TCP 231 55958 → 6379 [PSH, ACK] Seq=147522 Ack=9222 Win=1365 Len=165 TSval=1138886406 TSecr=1138885558
 3854 18.002912484    127.0.0.1 → 127.0.0.1    TCP 54 6379 → 55958 [RST] Seq=9222 Win=0 Len=0
 3855 18.957697051    127.0.0.1 → 127.0.0.1    TCP 107 55956 → 6379 [PSH, ACK] Seq=2449 Ack=236 Win=1395 Len=41 TSval=1138887361 TSecr=1138885558
 3856 18.957716403    127.0.0.1 → 127.0.0.1    TCP 54 6379 → 55956 [RST] Seq=236 Win=0 Len=0

The corresponding redis-server journal lines were:
Dec 15 20:59:44 fxtest4 systemd[1]: Stopped Advanced key-value store.
Dec 15 20:59:44 fxtest4 systemd[1]: Starting Advanced key-value store...
Dec 15 20:59:44 fxtest4 run-parts[744]: run-parts: executing /etc/redis/redis-server.pre-up.d/00_example
Dec 15 20:59:44 fxtest4 run-parts[750]: run-parts: executing /etc/redis/redis-server.post-up.d/00_example
Dec 15 20:59:44 fxtest4 systemd[1]: Started Advanced key-value store.

On manually restarting ntopng, it was able to reconnect to redis-server and work properly.
