### ISSUE TITLE
lua callback for packet payload

### ISSUE THREAD

**Issue by martinscheu** [ntop/ntopng#3797]
Hello,
Saving somewhere *only* the packet payload triggered after DPI protocol detection and make it available through lua callback.
Example with the IEC 60870 protocol:
Frame 13: 96 bytes on wire (768 bits), 96 bytes captured (768 bits)
Ethernet II, Src: CheckPoi_85:c9:2f (00:1c:7f:85:c9:2f), Dst: Oracle_42:aa:f5 (00:14:4f:42:aa:f5)
Internet Protocol Version 4, Src: 172.21.10.98, Dst: 172.21.3.61
Transmission Control Protocol, Src Port: 2404, Dst Port: 41069, Seq: 79, Ack: 1, Len: 42
IEC 60870-5-104: -> I (6803,1) 
IEC 60870-5-101/104 ASDU: ASDU=60 M_ME_NA_1 Spont   IOA[5]=1969294,... 'measured value, normalized value'
With flow.getnDPIAppProtoId() == 245 trigger the lua call back to get full payload.
Thank you.
