### ISSUE TITLE
packages.ntop.org seems to be down

### ISSUE THREAD

**Issue by tabooki** [ntop/ntopng#8935]
I'm unable to open this site for the past couple of days.

**Comment by tabooki** [comment]
Found the issue. For some reason my IP is blocked. Works fine if from my cell phone. Hrmmm

**Comment by tabooki** [comment]
Ping works so not dns. Browsers timeout.  Even the text browser lynx fails.

**Comment by lucaderi** [comment]
What is your IP ?

**Comment by tabooki** [comment]
72.53.158.xxx
I can telnet to port 80 and it connects fine.

Did a tcpdump if that helps 

root@gerp:~# tshark -r ntop_capture.pcap
Running as user "root" and group "root". This could be dangerous.
    1   0.000000 72.53.158.xcx → 167.99.215.164 TCP 74 59078 → 443 [SYN] Seq=0 Win=64240 Len=0 MSS=1460 SACK_PERM TSval=591731205 TSecr=0 WS=128
    2   0.002278 72.53.158.xxx → 167.99.215.164 TCP 74 59088 → 443 [SYN] Seq=0 Win=64240 Len=0 MSS=1460 SACK_PERM TSval=591731206 TSecr=0 WS=128
    3   0.103354 167.99.215.164 → 72.53.158.xxx TCP 74 443 → 59088 [SYN, ACK] Seq=0 Ack=1 Win=65160 Len=0 MSS=1460 SACK_PERM TSval=143636689 TSecr=591731206 WS=128
    4   0.103602 167.99.215.164 → 72.53.158.xxx TCP 74 443 → 59078 [SYN, ACK] Seq=0 Ack=1 Win=65160 Len=0 MSS=1460 SACK_PERM TSval=143636690 TSecr=591731205 WS=128
    5   0.105413 72.53.158.xxx → 167.99.215.164 TCP 66 59088 → 443 [ACK] Seq=1 Ack=1 Win=64256 Len=0 TSval=591731311 TSecr=143636689
    6   0.105425 72.53.158.xxx → 167.99.215.164 TCP 66 59078 → 443 [ACK] Seq=1 Ack=1 Win=64256 Len=0 TSval=591731311 TSecr=143636690
    7   0.105839 72.53.158.xxx → 167.99.215.164 TCP 1514 [TCP segment of a reassembled PDU]
    8   0.105851 72.53.158.xxx → 167.99.215.164 TLSv1 377 Client Hello (SNI=packages.ntop.org)
    9   0.108105 72.53.158.xxx → 167.99.215.164 TCP 1514 [TCP segment of a reassembled PDU]
   10   0.108117 72.53.158.xxx → 167.99.215.164 TLSv1 441 Client Hello (SNI=packages.ntop.org)
   11   0.321076 72.53.158.xxx → 167.99.215.164 TCP 441 [TCP Retransmission] 59078 → 443 [PSH, ACK] Seq=1449 Ack=1 Win=64256 Len=375 TSval=591731526 TSecr=143636690 [TCP segment of a reassembled PDU]
   12   0.321088 72.53.158.xxx → 167.99.215.164 TCP 377 [TCP Retransmission] 59088 → 443 [PSH, ACK] Seq=1449 Ack=1 Win=64256 Len=311 TSval=591731526 TSecr=143636689 [TCP segment of a reassembled PDU]
   13   0.641597 72.53.158.xxx → 167.99.215.164 TCP 1514 [TCP Retransmission] 59088 → 443 [ACK] Seq=1 Ack=1 Win=64256 Len=1448 TSval=591731847 TSecr=143636689
   14   0.643688 72.53.158.xxx → 167.99.215.164 TCP 1514 [TCP Retransmission] 59078 → 443 [ACK] Seq=1 Ack=1 Win=64256 Len=1448 TSval=591731847 TSecr=143636690
   15   1.114583 167.99.215.164 → 72.53.158.xxx TCP 74 [TCP Retransmission] 443 → 59088 [SYN, ACK] Seq=0 Ack=1 Win=65160 Len=0 MSS=1460 SACK_PERM TSval=143637703 TSecr=591731206 WS=128
   16   1.114785 167.99.215.164 → 72.53.158.xxx TCP 74 [TCP Retransmission] 443 → 59078 [SYN, ACK] Seq=0 Ack=1 Win=65160 Len=0 MSS=1460 SACK_PERM TSval=143637703 TSecr=591731205 WS=128
   17   1.118543 72.53.158.xxx → 167.99.215.164 TCP 66 [TCP Dup ACK 5#1] 59088 → 443 [ACK] Seq=1760 Ack=1 Win=64256 Len=0 TSval=591732323 TSecr=143636689
   18   1.118556 72.53.158.xxx → 167.99.215.164 TCP 66 [TCP Dup ACK 6#1] 59078 → 443 [ACK] Seq=1824 Ack=1 Win=64256 Len=0 TSval=591732323 TSecr=143636690
   19   1.272650 72.53.158.xxx → 167.99.215.164 TCP 1514 [TCP Retransmission] 59088 → 443 [ACK] Seq=1 Ack=1 Win=64256 Len=1448 TSval=591732478 TSecr=143636689
   20   1.340981 72.53.158.xxx → 167.99.215.164 TCP 1514 [TCP Retransmission] 59078 → 443 [ACK] Seq=1 Ack=1 Win=64256 Len=1448 TSval=591732542 TSecr=143636690
   21   2.554118 72.53.158.xxx → 167.99.215.164 TCP 1514 [TCP Retransmission] 59088 → 443 [ACK] Seq=1 Ack=1 Win=64256 Len=1448 TSval=591733759 TSecr=143636689
   22   2.616717 72.53.158.xxx → 167.99.215.164 TCP 1514 [TCP Retransmission] 59078 → 443 [ACK] Seq=1 Ack=1 Win=64256 Len=1448 TSval=591733822 TSecr=143636690

**Comment by lucaderi** [comment]
So the server is not down if you can connect, right? I don;t see your IP listed in logs, not sure what you are doing. Closing for now: reopen it if necessary providing additional evidence
