### ISSUE TITLE
Problem with Cisco ASA and nTopNG

### ISSUE THREAD

**Issue by ghost** [ntop/ntopng#1729]
Hello,

I try to configure my Cisco router with nProbe/nTopNG.

My configuration is the following:
Cisco router --> nProbe (linux) --> nTopNG (Linux)

Cisco conf:
flow-export destination inside 192.168.111.30 2055 <-- this the nProbe's IP address with the port
flow-export template timeout-rate 1
flow-export delay flow-create 15

Flow export v9 is enabled for main cache
  Export source and destination details : 
  VRF ID : Default
    Source(1)       192.168.111.1 (Vlan1)
    Source(2)       192.168.111.1 (Vlan1)
    Destination(1)  192.168.111.30 (2055) 
  Version 9 flow records
  33319 flows exported in 1295 udp datagrams
  0 flows failed due to lack of export packet
  0 export packets were sent up to process level
  0 export packets were dropped due to no fib
  0 export packets were dropped due to adjacency issues
  0 export packets were dropped due to fragmentation failures
  0 export packets were dropped due to encapsulation fixup failures

nProbe status:

                      nprobe.service - nprobe extensible NetFlow v5/v9/IPFIX probe/collector for IPv4/v6
   Loaded: loaded (/etc/systemd/system/nprobe.service; enabled; vendor preset: disabled)
   Active: active (running) since Mon 2018-04-02 13:58:18 EDT; 1h 15min ago
  Process: 1247 ExecStopPost=/bin/rm -rf /run/nprobe.conf (code=exited, status=0/SUCCESS)
  Process: 1250 ExecStartPre=/bin/sh -c /bin/sed "/-g.*$\|-G.*\|--daemon-mode.*\|--pid-file.*/s/^/#/" /etc/nprobe/nprobe.conf > /run/nprobe.conf (code=exited, status=0/SUCCESS)
 Main PID: 1253 (nprobe)
   CGroup: /system.slice/nprobe.service
           ‚îî‚îÄ1253 /usr/local/bin/nprobe /run/nprobe.conf

Apr 02 13:58:18 nTop-Probe nprobe[1253]: 02/Apr/2018 13:58:18 [util.c:451] GeoIP: loaded AS IPv6 config file /usr/share/ntopng/httpdocs/geoip/GeoIPASNumv6.dat
Apr 02 13:58:18 nTop-Probe nprobe[1253]: 02/Apr/2018 13:58:18 [nprobe.c:8622] IPv6 traffic will NOT be exported/accounted by this probe
Apr 02 13:58:18 nTop-Probe nprobe[1253]: 02/Apr/2018 13:58:18 [nprobe.c:8623] due to configuration options (e.g. use NetFlow v9)
Apr 02 13:58:18 nTop-Probe nprobe[1253]: 02/Apr/2018 13:58:18 [nprobe.c:8624] Please use -V to set the version to other than NetFlow V5
Apr 02 13:58:18 nTop-Probe nprobe[1253]: 02/Apr/2018 13:58:18 [nprobe.c:8775] Not capturing packet from interface (collector mode)
Apr 02 13:58:18 nTop-Probe nprobe[1253]: 02/Apr/2018 13:58:18 [util.c:4511] Initializing ZMQ as server
Apr 02 13:58:18 nTop-Probe nprobe[1253]: 02/Apr/2018 13:58:18 [util.c:4554] Succesfully created ZMQ endpoint tcp://*:5556
Apr 02 13:58:18 nTop-Probe nprobe[1253]: 02/Apr/2018 13:58:18 [util.c:3589] nProbe changed user to 'nobody'
Apr 02 13:58:18 nTop-Probe nprobe[1253]: 02/Apr/2018 13:58:18 [collect.c:144] Flow collector listening on port 2055 (IPv4/v6)
Apr 02 13:58:18 nTop-Probe nprobe[1253]: 02/Apr/2018 13:58:18 [nprobe.c:8992] nProbe started successfully

nProbe conf:
--daemon-mode
-i=none
-n=none
--collector-port=2055
--zmq="tcp://*:5556"
-V 9

[xxxx@nTop-Probe ~]# netstat -tulpn
Active Internet connections (only servers)
Proto Recv-Q Send-Q Local Address           Foreign Address         State       PID/Program name    
tcp        0      0 0.0.0.0:5556            0.0.0.0:*               LISTEN      1253/nprobe               
udp        0      0 0.0.0.0:2055            0.0.0.0:*                           1253/nprobe                
udp6       0      0 :::2055                 :::*                                1253/nprobe         

nTopNG status:
ntopng.service - ntopng high-speed web-based traffic monitoring and analysis tool
   Loaded: loaded (/etc/systemd/system/ntopng.service; enabled; vendor preset: disabled)
   Active: active (running) since Mon 2018-04-02 14:13:52 EDT; 1h 3min ago
  Process: 19944 ExecStopPost=/bin/rm -rf /run/ntopng.conf (code=exited, status=0/SUCCESS)
  Process: 19946 ExecStartPre=/bin/sh -c /bin/sed "/-e.*$\|-G.*\|--daemon.*\|--pid.*/s/^/#/" /etc/ntopng/ntopng.conf > /run/ntopng.conf (code=exited, status=0/SUCCESS)
 Main PID: 19948 (ntopng)
   CGroup: /system.slice/ntopng.service
           ‚îî‚îÄ19948 /usr/local/bin/ntopng /run/ntopng.conf

Apr 02 14:45:00 ntopng ntopng[19948]: 02/Apr/2018 14:45:00 [Lua.cpp:6559] [Discover] Started periodic discovery on interface ens192
Apr 02 14:45:11 ntopng ntopng[19948]: 02/Apr/2018 14:45:11 [Lua.cpp:6559] [Discover] Completed periodic discovery on interface ens192
Apr 02 15:00:01 ntopng ntopng[19948]: 02/Apr/2018 15:00:01 [Lua.cpp:6559] [Discover] Started periodic discovery on interface lo
Apr 02 15:00:01 ntopng ntopng[19948]: 02/Apr/2018 15:00:01 [Lua.cpp:6559] [Discover] Completed periodic discovery on interface lo
Apr 02 15:00:01 ntopng ntopng[19948]: 02/Apr/2018 15:00:01 [Lua.cpp:6559] [Discover] Started periodic discovery on interface ens192
Apr 02 15:00:12 ntopng ntopng[19948]: 02/Apr/2018 15:00:12 [Lua.cpp:6559] [Discover] Completed periodic discovery on interface ens192
Apr 02 15:15:03 ntopng ntopng[19948]: 02/Apr/2018 15:15:03 [Lua.cpp:6559] [Discover] Started periodic discovery on interface lo
Apr 02 15:15:03 ntopng ntopng[19948]: 02/Apr/2018 15:15:03 [Lua.cpp:6559] [Discover] Completed periodic discovery on interface lo
Apr 02 15:15:03 ntopng ntopng[19948]: 02/Apr/2018 15:15:03 [Lua.cpp:6559] [Discover] Started periodic discovery on interface ens192
Apr 02 15:15:14 ntopng ntopng[19948]: 02/Apr/2018 15:15:14 [Lua.cpp:6559] [Discover] Completed periodic discovery on interface ens192

nProbe conf:
--daemon
-interface="tcp://192.168.100.91:5556"
-w=4000
--dns-mode=1
--sticky-hosts=local
--local-networks="192.168.0.0/16,10.0.0.0/8,172.16.0.0/12"

[xxxx@ntopng ~]# netstat -tulpn
Active Internet connections (only servers)
Proto Recv-Q Send-Q Local Address           Foreign Address         State       PID/Program name    
tcp        0      0 127.0.0.1:6379          0.0.0.0:*               LISTEN      12730/redis-server            
tcp        0      0 0.0.0.0:4000            0.0.0.0:*               LISTEN      19948/ntopng                   
udp        0      0 192.168.100.91:59376    0.0.0.0:*                           19948/ntopng        
udp        0      0 0.0.0.0:42139           0.0.0.0:*                           19948/ntopng        
udp        0      0 0.0.0.0:36007           0.0.0.0:*                           19948/ntopng        

For my part, everything seems correct, but I do not receive any trace of traffic coming from the Internet (cisco router). Top Remote Destinations is empty except "broadcast" entry sometimes. I see the subnet traffic only where nTopNG and nProbe are located and because I activated a Network Discovery (I suppose).

tcpdump -i ens224 -n udp port 2055
tcpdump: verbose output suppressed, use -v or -vv for full protocol decode
listening on ens224, link-type EN10MB (Ethernet), capture size 262144 bytes
11:31:01.028468 IP 192.168.111.1.62235 > 192.168.111.30.iop: UDP, length 194
11:31:02.072731 IP 192.168.111.1.54884 > 192.168.111.30.iop: UDP, length 1428
11:31:03.028550 IP 192.168.111.1.62235 > 192.168.111.30.iop: UDP, length 228
11:31:05.028571 IP 192.168.111.1.62235 > 192.168.111.30.iop: UDP, length 262
^C
4 packets captured
4 packets received by filter
0 packets dropped by kernel

Somebody might tell me what's wrong with what I did.

Thanks for your help

**Comment by emanuele-f** [comment]
Hi, there is a typo into the ntopng configuration, please replace `-interface` with `--interface`

**Comment by emanuele-f** [comment]
@cepsum have you solved the issue?

**Comment by emanuele-f** [comment]
Closing for inactivity

**Comment by ghost** [comment]
Hello,

You can close this ticket.

Thank you for your help.

Best regards,

**Comment by emanuele-f** [comment]
Thank you
