### ISSUE TITLE
Active Monitoring - Continuous ICMP not functional even though ICMP works

### ISSUE THREAD

**Issue by tchuongpanasonic** [ntop/ntopng#10182]
**Environment**:
* OS name: Rocky Linux 
* OS version: 9.7
* Architecture: x86
* ntopng version/revision: v.6.7.260318

**What happened**:

ntopng is installed on a physical host with bonded interfaces and VLAN tagged MGMT traffic. Active monitoring - ICMP to 8.8.8.8 works fine, but continuous ICMP is not working. 

<img width="1506" height="95" alt="Image" src="https://github.com/user-attachments/assets/dea33583-e9be-4042-ba11-486f409cf3eb" />

**How did you reproduce it?**

Active monitoring on other VM ntopng instances with the same software release work fine. 

**Debug Information**:

When performing a tcpdump on the VLAN tagged MGMT interface, only the ICMP probe is observed. Active Monitoring - ICMP is not sending out any traffic 

sudo tcpdump -ni bond-mgmt.2 icmp and host 8.8.8.8
dropped privs to tcpdump
tcpdump: verbose output suppressed, use -v[v]... for full protocol decode
listening on bond-mgmt.2, link-type EN10MB (Ethernet), snapshot length 262144 bytes
23:27:00.905570 IP INTERNAL > 8.8.8.8: ICMP echo request, id 58609, seq 1, length 64
23:27:00.908159 IP 8.8.8.8 > 172.16.82.168: ICMP echo reply, id 58609, seq 1, length 64
23:28:04.319286 IP INTERNAL > 8.8.8.8: ICMP echo request, id 58609, seq 2, length 64
23:28:04.321809 IP 8.8.8.8 > 172.16.82.168: ICMP echo reply, id 58609, seq 2, length 64
23:29:01.206429 IP INTERNAL > 8.8.8.8: ICMP echo request, id 58609, seq 2, length 64
23:29:01.209019 IP 8.8.8.8 > 172.16.82.168: ICMP echo reply, id 58609, seq 2, length 64

**ICMP returns a value, but CICMP is returning 0**

Mar 20 23:21:11  ntopng[2216500]: 20/Mar/2026 23:21:11 [InfluxDBTimeseriesExporter.cpp:113] [__system__] am_host:val_min,ifid=-1,host=8.8.8.8,metric=icmp value=2.64 1774048860
Mar 20 23:21:11  ntopng[2216500]: 20/Mar/2026 23:21:11 [InfluxDBTimeseriesExporter.cpp:113] [__system__] am_host:val_min,ifid=-1,host=8.8.8.8,metric=**cicmp value=0** 1774048860
Mar 20 23:22:11  ntopng[2216500]: 20/Mar/2026 23:22:11 [InfluxDBTimeseriesExporter.cpp:113] [__system__] am_host:val_min,ifid=-1,host=8.8.8.8,metric=**icmp value=2.54** 1774048920
Mar 20 23:22:11  ntopng[2216500]: 20/Mar/2026 23:22:11 [InfluxDBTimeseriesExporter.cpp:113] [__system__] am_host:val_min,ifid=-1,host=8.8.8.8,metric=cicmp value=0 1774048920

**Comment by tchuongpanasonic** [comment]
@cardigliano, are you able to reproduce this issue in your lab?

**Comment by cardigliano** [comment]
@tchuongpanasonic Continuous ICMP is working in our lab. Could you check what is the selected interface for each of them? I also suggest to use two different IP addresses (e.g. 8.8.8.8 and 8.8.4.4) and check with tcpdump if requests are sent out

**Comment by tchuongpanasonic** [comment]
@cardigliano, we have multiple destinations configured and even CICMP to our GW IP address does not work. For both ICMP and CICMP, it does not provide us with an option to select an interface, see image below. 

<img width="887" height="585" alt="Image" src="https://github.com/user-attachments/assets/a5b1431b-5cf5-4133-8dc5-92f3a4232470" />

<img width="1281" height="284" alt="Image" src="https://github.com/user-attachments/assets/740a010b-11a0-4284-92f0-f282d3f1802d" />

<img width="1685" height="374" alt="Image" src="https://github.com/user-attachments/assets/f40fec84-eee3-4478-ae1d-ffe876aa9f7a" />

**Comment by cardigliano** [comment]
This is strange, I did double check and ntopng should list all the interfaces with an IP address, that you can use to ping..
Do you see any warning in the service logs? I will try to add some more message to figure out what's going on there.

**Comment by tchuongpanasonic** [comment]
No warnings in the service log. On another virtualized ntopng instance with a trunk + VLAN tagged interface where CICMP is working, we are able to select an interface.

<img width="817" height="599" alt="Image" src="https://github.com/user-attachments/assets/db7b2d58-b5f2-4e77-9f71-bc7a73edf17b" />

**Comment by cardigliano** [comment]
I added more messages, please install the next update later today and report the logs. Thank you

**Comment by tchuongpanasonic** [comment]
Updated to v6.7.260331. There are no visible errors in the system logs.

ntopng does not present the option to select an "Interface Used". What criteria does ntopng look for to present this?

<img width="805" height="536" alt="Image" src="https://github.com/user-attachments/assets/5566c13a-ac28-4e01-b284-20b3d4f60cf4" />

<img width="248" height="187" alt="Image" src="https://github.com/user-attachments/assets/3f652401-ba29-4576-809b-2847798afc60" />

**Comment by cardigliano** [comment]
@tchuongpanasonic the update was not yet ready, please try again now and provide the logs. Thank you.

**Comment by tchuongpanasonic** [comment]
Updated to v6.7.260401. Active Monitoring page hangs. No other warnings or errors observed. 

01/Apr/2026 16:30:49 [LuaEngine.cpp:1670] **WARNING Script failure** [/usr/share/ntopng/scripts/lua/rest/v2/get/active_monitoring/list.lua][/usr/share/ntopng/scripts/lua/modules/active_monitoring.lua:134: attempt to index a nil value (global 'format_utils')]

<img width="1776" height="748" alt="Image" src="https://github.com/user-attachments/assets/8466b32c-4604-49c9-8d5b-ce60cf679aa0" />

**Comment by cardigliano** [comment]
@tchuongpanasonic please update again

**Comment by tchuongpanasonic** [comment]
Updated to v6.7.260402. Did not observe any warnings or errors in the system logs. 

@cardigliano, this server has both ntopng and cento/PF_RING installed. bond-mgmt.2 comprises of ens1f0 & ens1f1. It looks like since ntopng is starting bond-mgmt.2 and its associated interfaces with PF_RING, I am assuming that's why we are unable to select an interface under the active monitoring window. 

All interfaces for this server are using intel E810 NICs. 

<img width="517" height="118" alt="Image" src="https://github.com/user-attachments/assets/7e193548-f85d-4e61-9b4d-159182f3ce5a" />

Mar 31 22:46:34  ntopng[3011]: 31/Mar/2026 22:46:34 [PF_RINGInterface.cpp:73] Reading packets from PF_RING v.9.3.0 interface ens1f0...
Mar 31 22:46:34  ntopng[3011]: 31/Mar/2026 22:46:34 [PF_RINGInterface.cpp:73] Reading packets from PF_RING v.9.3.0 interface ens1f1...
Mar 31 22:46:34  ntopng[3011]: 31/Mar/2026 22:46:34 [PF_RINGInterface.cpp:73] Reading packets from PF_RING v.9.3.0 interface ens1f2...
Mar 31 22:46:34  ntopng[3011]: 31/Mar/2026 22:46:34 [PF_RINGInterface.cpp:73] Reading packets from PF_RING v.9.3.0 interface ens1f3...
Mar 31 22:46:34  ntopng[3011]: 31/Mar/2026 22:46:34 [PF_RINGInterface.cpp:73] Reading packets from PF_RING v.9.3.0 interface ens15f2...
Mar 31 22:46:35  ntopng[3011]: 31/Mar/2026 22:46:35 [PF_RINGInterface.cpp:73] Reading packets from PF_RING v.9.3.0 interface ens15f3...
Mar 31 22:46:35  ntopng[3011]: 31/Mar/2026 22:46:35 [PF_RINGInterface.cpp:73] Reading packets from PF_RING v.9.3.0 interface bond-mgmt.2...
Mar 31 22:46:35  ntopng[3011]: 31/Mar/2026 22:46:35 [Ntop.cpp:3821] Registered interface 'bond-mgmt.2' [id: 22]

pf_ringcfg --list-interfaces
Name: ens1f0               Driver: ice        RSS:     32   [Supported by ZC]
Name: ens1f1               Driver: ice        RSS:     32   [Supported by ZC]
Name: ens1f2               Driver: ice        RSS:     32   [Supported by ZC]
Name: ens1f3               Driver: ice        RSS:     32   [Supported by ZC]
Name: ens15f0              Driver: ice        RSS:     32   [Supported by ZC]
Name: ens15f1              Driver: ice        RSS:     32   [Supported by ZC]
Name: ens15f2              Driver: ice        RSS:     32   [Supported by ZC]
Name: ens15f3              Driver: ice        RSS:     32   [Supported by ZC]
Name: bond-mgmt            Driver: bonding    RSS:     16   [Linux Driver] 
Name: bond-mgmt.2          Driver: 802.1Q     RSS:     1    [Linux Driver]

**Comment by cardigliano** [comment]
@tchuongpanasonic please provide the full log, you are not expected to see warnings, just info messages. ntopng should detect system interfaces with an ip address, regardless of those used for capture.

**Comment by tchuongpanasonic** [comment]
Logs emailed

**Comment by cardigliano** [comment]
7aeffe7ef98150bff0a34adf34a2b3accbaff072 should fix this

**Comment by tchuongpanasonic** [comment]
Updated to v6.7.260409 rev.27911. Should the fix allow us to select an interface now? CICMP still does not appear to be working. 

Debug logs emailed.

**Comment by tchuongpanasonic** [comment]
Updated to **v6.7.260413**, CICMP now works on the bonded management interface and inference selection is now available for all active monitoring tests.

<img width="782" height="574" alt="Image" src="https://github.com/user-attachments/assets/e949e6c8-35d3-4d2f-b8a2-c1006082e423" />

**Comment by cardigliano** [comment]
Sounds great! Thank you
