### ISSUE TITLE
Processing syslog messages

### ISSUE THREAD

**Issue by CyberbreinAirw0lf** [ntop/ntopng#4773]
I'm experiencing some challenges with processing syslog messages.

See also attached images and "code"-sections below:
- the alerts dashboard states "no alerts"
- the syslog interface stats shows a few 1000 "collected logs"
- however, the same image states "no traffic"
- the syslog producers are configured as explained in paragraph 12.2 of the manual
- the firewall on the ntopng system has 514 in the list for UDP and TCP
- tcpdump shows incoming syslog traffic
- the command "service ntopng status" states "collecting events on syslog://*:514"

Based on the above I would expect at least "something" in the Alerts Dashboard.
What am I missing/overlooking here?

Kind regards - Will

=====

Config in ntopng.conf:
-i=syslog://*:514

```
service ntopng status:
Oct 30 19:50:13 npm-2.itv.lan ntopng[21132]: 30/Oct/2020 19:50:13 [SyslogCollectorInterface.cpp:338] Collecting events on syslog://*:514
```

```
root@npm-2:/home/will# ufw status
Status: active

To                         Action      From
--                         ------      ----
22                         ALLOW       Anywhere
443                        ALLOW       Anywhere
80                         ALLOW       Anywhere
5556/tcp                   ALLOW       Anywhere
514                        ALLOW       Anywhere
```

```
root@npm-2:/home/will# tcpdump -i any port 514
tcpdump: verbose output suppressed, use -v or -vv for full protocol decode
listening on any, link-type EN10MB (Ethernet), capture size 262144 bytes
19:54:31.661712 IP esx-1.itv.lan.12786 > hub.itv.lan.syslog: SYSLOG local4.debug, length: 244
19:54:31.661746 IP esx-1.itv.lan.12786 > hub.itv.lan.syslog: SYSLOG local4.debug, length: 244
19:54:31.661747 IP esx-1.itv.lan.53285 > npm-2.itv.lan.syslog: SYSLOG local4.debug, length: 244
19:54:31.661751 IP esx-1.itv.lan.53285 > npm-2.itv.lan.syslog: SYSLOG local4.debug, length: 244
19:54:31.661771 IP esx-1.itv.lan.53285 > npm-2.itv.lan.syslog: SYSLOG local4.debug, length: 244
19:54:31.663011 IP esx-1.itv.lan.12786 > hub.itv.lan.syslog: SYSLOG local4.debug, length: 244
19:54:31.663018 IP esx-1.itv.lan.12786 > hub.itv.lan.syslog: SYSLOG local4.debug, length: 244
19:54:31.663064 IP esx-1.itv.lan.53285 > npm-2.itv.lan.syslog: SYSLOG local4.debug, length: 244
19:54:31.663068 IP esx-1.itv.lan.53285 > npm-2.itv.lan.syslog: SYSLOG local4.debug, length: 244
19:54:31.663077 IP esx-1.itv.lan.53285 > npm-2.itv.lan.syslog: SYSLOG local4.debug, length: 244
19:54:31.707557 IP ap-1.itv.lan.54939 > npm-2.itv.lan.syslog: SYSLOG daemon.info, length: 86
19:54:31.707557 IP ap-1.itv.lan.54939 > npm-2.itv.lan.syslog: SYSLOG daemon.info, length: 86
19:54:31.707588 IP ap-1.itv.lan.54939 > npm-2.itv.lan.syslog: SYSLOG daemon.info, length: 86
19:54:31.739657 IP ap-1.itv.lan.54939 > npm-2.itv.lan.syslog: SYSLOG daemon.info, length: 86
19:54:31.739664 IP ap-1.itv.lan.54939 > npm-2.itv.lan.syslog: SYSLOG daemon.info, length: 86
19:54:31.739734 IP ap-1.itv.lan.54939 > npm-2.itv.lan.syslog: SYSLOG daemon.info, length: 86
19:54:31.771477 IP ap-1.itv.lan.54939 > npm-2.itv.lan.syslog: SYSLOG daemon.info, length: 86
19:54:31.771484 IP ap-1.itv.lan.54939 > npm-2.itv.lan.syslog: SYSLOG daemon.info, length: 86
19:54:31.771501 IP ap-1.itv.lan.54939 > npm-2.itv.lan.syslog: SYSLOG daemon.info, length: 86
19:54:31.803506 IP ap-1.itv.lan.54939 > npm-2.itv.lan.syslog: SYSLOG daemon.info, length: 86
19:54:31.803510 IP ap-1.itv.lan.54939 > npm-2.itv.lan.syslog: SYSLOG daemon.info, length: 86
19:54:31.803535 IP ap-1.itv.lan.54939 > npm-2.itv.lan.syslog: SYSLOG daemon.info, length: 86
19:54:31.836623 IP ap-1.itv.lan.54939 > npm-2.itv.lan.syslog: SYSLOG daemon.info, length: 86
19:54:31.836624 IP ap-1.itv.lan.54939 > npm-2.itv.lan.syslog: SYSLOG daemon.info, length: 86
19:54:31.836626 IP ap-1.itv.lan.54939 > npm-2.itv.lan.syslog: SYSLOG daemon.info, length: 86
```

![image](https://user-images.githubusercontent.com/64280991/97746926-722b2900-1aeb-11eb-9b90-1dc8ce6de8af.png)

![image](https://user-images.githubusercontent.com/64280991/97747287-039a9b00-1aec-11eb-8909-e5c5c5d306ed.png)

**Comment by cardigliano** [comment]
@NogNeetMachinaal you should be able to see one more column in the stats page as you can see in the enclosed picture, if that's not the case, we need to fix this page. Please check again.
<img width="1225" alt="Screen Shot 2020-11-23 at 14 57 22" src="https://user-images.githubusercontent.com/7548711/99970551-4888b900-2d9c-11eb-8486-849b535f210b.png">

**Comment by CyberbreinAirw0lf** [comment]
I don't remember seeing that - where exactly is this supposed to show up?

**Comment by cardigliano** [comment]
It's in the stats page under the Interface menu (same page you posted in the first comment)

**Comment by CyberbreinAirw0lf** [comment]
Nope – no table like that.

Only “something” that is showing several megabytes on syslog messages.

And 500k on dropped messages.

**Comment by CyberbreinAirw0lf** [comment]
Where are we on this? Anything?

**Comment by cardigliano** [comment]
@NogNeetMachinaal could you provide a screenshot of the interface page with stats please?

**Comment by CyberbreinAirw0lf** [comment]
See attached: each of these 2 are taken with ff and full-page.

Is this what you are looking for?

 

 

Kind regards – Will

 

=====

**Comment by cardigliano** [comment]
@NogNeetMachinaal I do not see the screenshots, if you are using your mail client, please go to github

**Comment by CyberbreinAirw0lf** [comment]
Ok - here they are.

Two images - one with the LAN-stats and one with the syslog-stats; both the complete page.

![lan-stats](https://user-images.githubusercontent.com/64280991/100435580-6a38b780-309e-11eb-9060-11ea5610bf28.jpg)

![syslog-stats](https://user-images.githubusercontent.com/64280991/100435760-ac61f900-309e-11eb-983e-f034db47054d.jpg)

**Comment by cardigliano** [comment]
@NogNeetMachinaal please note the scroll bar at the bottom, could you zoom the screen or move the bar to provide the whole page?

**Comment by CyberbreinAirw0lf** [comment]
That is the horizontal scroll bar => nothing more to see when scrolling.

Will post proof in an hour.

**Comment by CyberbreinAirw0lf** [comment]
Below the "proof" - the scrollbar doesn't go away.
Again - if scrolling to the right there is nothing - other then the right site of the table. 

![Networking - Interface LAN](https://user-images.githubusercontent.com/64280991/100448714-07055000-30b3-11eb-9bf5-59600ad2c3d3.png)

![Networking - Interface Syslog](https://user-images.githubusercontent.com/64280991/100448729-0a98d700-30b3-11eb-9943-82d819af789b.png)

**Comment by cardigliano** [comment]
@NogNeetMachinaal sorry for late reply, due to this ping pong this is becoming a long story :-) What about scheduling a call to finally close this issue?

**Comment by CyberbreinAirw0lf** [comment]
Any luck for tomorrow at 4 PM?

**Comment by cardigliano** [comment]
I will be in a meeting probably, what about today or tomorrow morning? Anyway please write a direct email to schedule this.

**Comment by cardigliano** [comment]
It seems that the messages got discarded due to missing host information in the syslog message. I pushed an enhancement to read the host from the message source also in udp mode. A new build should be available soon.

**Comment by cardigliano** [comment]
Update: the endpoint configuration was messed up, causing the alerts to get lost, a configuration reset fixed this.
