### ISSUE TITLE
ntopng-5.0-stable repeatedly stops recording at ZMQ source

### ISSUE THREAD

**Issue by GrumpyOldNetworkGuy** [ntop/ntopng#5867]
Hi,

Restarting ntopng reactivates recording on nprobe@xwin[0,1].  The other two ZMQ sources (LAN, DC) work perfectly.
![Interface-X-WIN](https://user-images.githubusercontent.com/86432254/133104479-73d349e3-57f2-4db6-a9b2-6b35741185b6.png)
The only strange thing I found is that minute.lua is causing problems at the same time:
![X-WIN-periodic-activities](https://user-images.githubusercontent.com/86432254/133106170-d8e88b3c-b411-4807-b3d1-410f75d72e6a.png)
If it gets very bad, at the same moment the GUI stops working. The connection to TCP/3443 is then still  up.

The TCP connection between nprobe @ xwin [0,1] is intact. But no data flows:
```
root@schnuffel:~# tcpdump -nni lo 'tcp port (5556 or 5557)'
tcpdump: verbose output suppressed, use -v or -vv for full protocol decode
listening on lo, link-type EN10MB (Ethernet), capture size 262144 bytes
16:38:17.012950 IP 127.0.0.1.52584 > 127.0.0.1.5556: Flags [.], ack 1026771819, win 0, options [nop,nop,TS val 586928350 ecr 586897629], length 0
16:38:17.012956 IP 127.0.0.1.55016 > 127.0.0.1.5557: Flags [.], ack 3057400202, win 0, options [nop,nop,TS val 586928350 ecr 586897629], length 0
16:38:17.013001 IP 127.0.0.1.5556 > 127.0.0.1.52584: Flags [.], ack 1, win 256, options [nop,nop,TS val 586928350 ecr 586909914], length 0
16:38:17.013008 IP 127.0.0.1.5557 > 127.0.0.1.55016: Flags [.], ack 1, win 256, options [nop,nop,TS val 586928350 ecr 586907865], length 0
16:38:47.728936 IP 127.0.0.1.52584 > 127.0.0.1.5556: Flags [.], ack 1, win 0, options [nop,nop,TS val 586959066 ecr 586928350], length 0
16:38:47.728945 IP 127.0.0.1.55016 > 127.0.0.1.5557: Flags [.], ack 1, win 0, options [nop,nop,TS val 586959066 ecr 586928350], length 0
16:38:47.728964 IP 127.0.0.1.5556 > 127.0.0.1.52584: Flags [.], ack 1, win 256, options [nop,nop,TS val 586959066 ecr 586909914], length 0
16:38:47.728976 IP 127.0.0.1.5557 > 127.0.0.1.55016: Flags [.], ack 1, win 256, options [nop,nop,TS val 586959066 ecr 586907865], length 0
^C
8 packets captured
16 packets received by filter
0 packets dropped by kernel
root@schnuffel:~# 
```
To make things as easy as possible for ntopng, almost all checks have been disabled. By the way, apart from "unexpected DHCP", the checks shown here cannot be diabled. The error message is "Unknown user script ...".
![checks](https://user-images.githubusercontent.com/86432254/133109388-50f47463-d3f7-4384-8aea-a32ad4bbe061.png)

Here is the configuration:
[configs.txt](https://github.com/ntop/ntopng/files/7155378/configs.txt)

How can I help you find the cause?

Thanks! 
Gerd

**Comment by GrumpyOldNetworkGuy** [comment]
Hi,

Our ntopng fails again like in the last few days.
- ZMQ traffic between nprobe@xwin0 and ntopng stalled
- ZMQ traffic between nprobe@xwin1 and ntopng stalled
- ZMQ traffic nprobe@lan <-> ntopng looks good
- ZMQ traffic nprobe@dc <-> ntopng looks good
- HTTPS connection to ntopng crashed, reconnect impossible: 
```
root@schnuffel:~# tcpdump -nni br224 'tcp port 3443'
tcpdump: verbose output suppressed, use -v or -vv for full protocol decode
listening on br224, link-type EN10MB (Ethernet), capture size 262144 bytes
14:38:46.329208 IP 10.139.205.11.33108 > 10.139.192.11.3443: Flags [S], seq 4107689044, win 64240, options [mss 1250,sackOK,TS val 2013915497 ecr 0,nop,wscale 7], length 0
14:38:46.329510 IP 10.139.205.11.33110 > 10.139.192.11.3443: Flags [S], seq 3147065321, win 64240, options [mss 1250,sackOK,TS val 2013915497 ecr 0,nop,wscale 7], length 0
14:38:46.329535 IP 10.139.205.11.33112 > 10.139.192.11.3443: Flags [S], seq 335358759, win 64240, options [mss 1250,sackOK,TS val 2013915497 ecr 0,nop,wscale 7], length 0
14:38:46.329553 IP 10.139.205.11.33114 > 10.139.192.11.3443: Flags [S], seq 2502990202, win 64240, options [mss 1250,sackOK,TS val 2013915497 ecr 0,nop,wscale 7], length 0
14:38:46.329568 IP 10.139.205.11.33116 > 10.139.192.11.3443: Flags [S], seq 1498458717, win 64240, options [mss 1250,sackOK,TS val 2013915497 ecr 0,nop,wscale 7], length 0
```
Restarting ntopng again... Please, can someone help me. I have no more idea.
Gerd

**Comment by simonemainardi** [comment]
Seems `minute.lua` stalls. Please, post full nProbe and ntopng configurations. Also include recipients and endpoints if you are using them.

**Comment by GrumpyOldNetworkGuy** [comment]
@simonemainardi Here are the complete configuration files: [schnuffel-conf.zip](https://github.com/ntop/ntopng/files/7163602/schnuffel-conf.zip)
No recipients or endpoints are configured in addition to  builtin_recipient_sqlite/builtin_endpoint_sqlite.  No alarms have been recorded in the last 24 hours.

**Comment by GrumpyOldNetworkGuy** [comment]
@simonemainardi 

--- 18:50 CEST ---
- ZMQ traffic between nprobe@xwin0 and ntopng stalled
- ZMQ traffic between nprobe@xwin1 and ntopng stalled
- ZMQ traffic nprobe@lan <-> ntopng looks good
- ZMQ traffic nprobe@dc <-> ntopng looks good
- HTTPS connection to ntopng crashed, reconnect impossible

Now I started ntopng with only nprobe@xwin0 and nprobe@xwin1 as the source:
```
--- ntopng.conf ---
#
#-i=br980
-i=tcp://127.0.0.1:5556,tcp://127.0.0.1:5557
#-i=tcp://127.0.0.1:5558
#-i=tcp://127.0.0.1:5559
#
```
Let's wait for the next standstill.

How do you think. Should I upgrade to the nightly builds packages and test them out?

**Comment by GrumpyOldNetworkGuy** [comment]
@simonemainardi 
--- 02:10 CEST ---
- ZMQ traffic between nprobe@xwin0 and ntopng stalled
- ZMQ traffic between nprobe@xwin1 and ntopng stalled
- GUI works but is  very slow
- minute.lua stucks since 02:10 CEST

![Interface-X-WIN](https://user-images.githubusercontent.com/86432254/133377364-a90c6113-5411-42c4-adcf-7b7a138f37f4.png)
![X-WIN-minute lua](https://user-images.githubusercontent.com/86432254/133377381-a3d7f7aa-2994-4df8-a0f4-b4fc1dbbca8c.png)
![Script-failure](https://user-images.githubusercontent.com/86432254/133377402-7d2fd556-f924-48e9-a06e-12fd79ceee92.png)

Now I start ntopng with a direct connection of zc:ens2f0@0,zc:ens2f0@1 without nprobe:
```
--- ntopng.conf ---
#
#-i=br980
#-i=tcp://127.0.0.1:5556,tcp://127.0.0.1:5557
-i=zc:ens2f0@0,zc:ens2f0@1
#-i=tcp://127.0.0.1:5558
#-i=tcp://127.0.0.1:5559
#
```
I'm curious...

**Comment by GrumpyOldNetworkGuy** [comment]
@simonemainardi It's crazy, but now I was able to turn off the rest of the ckecks:


![Checks-Flow-Disabled](https://user-images.githubusercontent.com/86432254/133381882-f3fe9bac-c28c-4e93-b61c-977d90dc0c57.png)

**Comment by simonemainardi** [comment]
Do you have top sites or traffic behavior enabled?

**Comment by GrumpyOldNetworkGuy** [comment]
Both are switched off.

In the current test, ntopng drops packets like hell:
![Packets-vs-Drops](https://user-images.githubusercontent.com/86432254/133389468-cd0ac140-dfac-4d6e-beab-1aa814b6b91d.png)

![Interface-X-WIN-drops](https://user-images.githubusercontent.com/86432254/133388966-b959fc26-d317-4e6f-8d68-2dcdebb5c2af.png)

**Comment by GrumpyOldNetworkGuy** [comment]
@simonemainardi 
--- 11:17 CEST ---
- direct ntopng input on "zc:ens2f0@0,zc:ens2f0@1" stalled
- GUI works but is very slow
- minute.lua stucks since 11:17 CEST

So ZMQ is probably not the problem.
![Interface-X-WIN2](https://user-images.githubusercontent.com/86432254/133410299-4e0e75e1-91ba-4e25-a43a-7dcc8e65f7e8.png)
![X-WIN-minute lua2](https://user-images.githubusercontent.com/86432254/133410327-9ac4710b-d515-4dc7-9146-396852894096.png)

**Comment by GrumpyOldNetworkGuy** [comment]
@simonemainardi I restarted ntopng. Now it is using inluxdb on another host. The other settings are the same as in the previous experiment.

**Comment by GrumpyOldNetworkGuy** [comment]
@simonemainardi 
--- 19:44 CEST ---
- direct ntopng input on "zc:ens2f0@0,zc:ens2f0@1" stalled
- GUI disconnected

Running influxdb on another host didn't help either.

**Comment by simonemainardi** [comment]
Can we arrange a remote session to troubleshoot? As soon as you find the process stuck again drop me an email at mainardi at ntop dot org and I can connect.

**Comment by simonemainardi** [comment]
I've fixed an issue possibly causing this behavior. New dev and stable builds are in progress, please hold on a couple of hours, update, and let me know. Thanks for providing the machine for the debugging.

**Comment by simonemainardi** [comment]
@GrumpyOldNetworkGuy can you please confirm and close this issue is solved? Thanks.

**Comment by GrumpyOldNetworkGuy** [comment]
New uptime record for ntopng-5.0-stable: 2 Days, 16:01:04!
Thank you @simonemainardi for fixing this issue.
